timestamp,tweet_id,source,text,rating_numerator,rating_denominator,name,type,date,time,rating,jpg_url,confidence,dog,created_at,favorite_count,retweet_count,followers_count,favourites_count
2017-07-31 00:18:03,891815181378084864,iPhone,This is Archie. He is a rare Norwegian Pouncing Corgo. Lives in the tall grass. You never know when one may strike. 12/10,12.0,10.0,Archie,,31-07-2017,00:18,1.2,https://pbs.twimg.com/media/DGBdLU1WsAANxJ9.jpg,0.716012,chihuahua,2017-07-31 00:18:03,24622,4078,7523763,140516
2017-07-30 15:58:51,891689557279858688,iPhone,This is Darla. She commenced a snooze mid meal. 13/10 happens to the best of us,13.0,10.0,Darla,,30-07-2017,15:58,1.3,https://pbs.twimg.com/media/DF_q7IAWsAEuuN8.jpg,0.17027799999999998,paper towel,2017-07-30 15:58:51,41475,8484,7523763,140516
2017-07-29 16:00:24,891327558926688256,iPhone,"This is Franklin. He would like you to stop calling him ""cute."" He is a very fierce shark and should be respected as such. 12/10 #BarkWeek",12.0,10.0,Franklin,,29-07-2017,16:00,1.2,https://pbs.twimg.com/media/DF6hr6BUMAAzZgT.jpg,0.555712,basset,2017-07-29 16:00:24,39636,9169,7523763,140516
2017-07-29 00:08:17,891087950875897856,iPhone,Here we have a majestic great white breaching off South Africa's coast. Absolutely h*ckin breathtaking. 13/10 (IG: tucker_marlo) #BarkWeek,13.0,10.0,,,29-07-2017,00:08,1.3,https://pbs.twimg.com/media/DF3HwyEWsAABqE6.jpg,0.425595,chesapeake bay retriever,2017-07-29 00:08:17,19903,3055,7523763,140516
2017-07-28 00:22:40,890729181411237888,iPhone,When you watch your owner call another dog a good boy but then they turn back to you and say you're a great boy. 13/10,13.0,10.0,,,28-07-2017,00:22,1.3,https://pbs.twimg.com/media/DFyBahAVwAAhUTd.jpg,0.566142,pomeranian,2017-07-28 00:22:40,64319,18508,7523763,140516
2017-07-27 16:25:51,890609185150312448,iPhone,This is Zoey. She doesn't want to be one of the scary sharks. Just wants to be a snuggly pettable boatpet. 13/10 #BarkWeek,13.0,10.0,Zoey,,27-07-2017,16:25,1.3,https://pbs.twimg.com/media/DFwUU__XcAEpyXI.jpg,0.487574,irish terrier,2017-07-27 16:25:51,27353,4194,7523763,140516
2017-07-26 00:31:25,890006608113172480,iPhone,This is Koda. He is a South Australian deckshark. Deceptively deadly. Frighteningly majestic. 13/10 would risk a petting #BarkWeek,13.0,10.0,Koda,,26-07-2017,00:31,1.3,https://pbs.twimg.com/media/DFnwSY4WAAAMliS.jpg,0.957979,samoyed,2017-07-26 00:31:25,30166,7193,7523763,140516
2017-07-25 00:10:02,889638837579907072,iPhone,This is Ted. He does his best. Sometimes that's not enough. But it's ok. 12/10 would assist,12.0,10.0,Ted,,25-07-2017,00:10,1.2,https://pbs.twimg.com/media/DFihzFfXsAYGDPR.jpg,0.99165,french bulldog,2017-07-25 00:10:02,26700,4457,7523763,140516
2017-07-24 00:19:32,889278841981685760,iPhone,This is Oliver. You're witnessing one of his many brutal attacks. Seems to be playing with his victim. 13/10 fr*ckin frightening #BarkWeek,13.0,10.0,Oliver,,24-07-2017,00:19,1.3,https://pbs.twimg.com/ext_tw_video_thumb/889278779352338437/pu/img/VlbFB3v8H8VwzVNY.jpg,0.626152,whippet,2017-07-24 00:19:32,24836,5274,7523763,140516
2017-07-23 00:22:39,888917238123831296,iPhone,This is Jim. He found a fren. Taught him how to sit like the good boys. 12/10 for both,12.0,10.0,Jim,,23-07-2017,00:22,1.2,https://pbs.twimg.com/media/DFYRgsOUQAARGhO.jpg,0.714719,golden retriever,2017-07-23 00:22:39,28628,4409,7523763,140516
2017-07-22 00:23:06,888554962724278272,iPhone,This is Ralphus. He's powering up. Attempting maximum borkdrive. 13/10 inspirational af,13.0,10.0,Ralphus,,22-07-2017,00:23,1.3,https://pbs.twimg.com/media/DFTH_O-UQAACu20.jpg,0.700377,siberian husky,2017-07-22 00:23:06,19512,3485,7523763,140516
2017-07-20 16:49:33,888078434458587136,iPhone,This is Gerald. He was just told he didn't get the job he interviewed for. A h*ckin injustice. 12/10 didn't want the job anyway,12.0,10.0,Gerald,,20-07-2017,16:49,1.2,https://pbs.twimg.com/media/DFMWn56WsAAkA7B.jpg,0.995026,french bulldog,2017-07-20 16:49:33,21405,3426,7523763,140516
2017-07-19 16:06:48,887705289381826560,iPhone,This is Jeffrey. He has a monopoly on the pool noodles. Currently running a 'boop for two' midweek sale. 13/10 h*ckin strategic,13.0,10.0,Jeffrey,,19-07-2017,16:06,1.3,https://pbs.twimg.com/media/DFHDQBbXgAEqY7t.jpg,0.821664,basset,2017-07-19 16:06:48,29670,5284,7523763,140516
2017-07-19 03:39:09,887517139158093824,iPhone,I've yet to rate a Venezuelan Hover Wiener. This is such an honor. 14/10 paw-inspiring af (IG: roxy.thedoxy),14.0,10.0,,,19-07-2017,03:39,1.4,https://pbs.twimg.com/ext_tw_video_thumb/887517108413886465/pu/img/WanJKwssZj4VJvL9.jpg,0.130432,limousine,2017-07-19 03:39:09,45527,11457,7523763,140516
2017-07-18 16:08:03,887343217045368832,iPhone,You may not have known you needed to see this today. 13/10 please enjoy (IG: emmylouroo),13.0,10.0,,,18-07-2017,16:08,1.3,https://pbs.twimg.com/ext_tw_video_thumb/887343120832229379/pu/img/6HSuFrW1lzI_9Mht.jpg,0.330741,mexican hairless,2017-07-18 16:08:03,33131,10211,7523763,140516
2017-07-18 00:07:08,887101392804085760,iPhone,This... is a Jubilant Antarctic House Bear. We only rate dogs. Please only send dogs. Thank you... 12/10 would suffocate in floof,12.0,10.0,,,18-07-2017,00:07,1.2,https://pbs.twimg.com/media/DE-eAq6UwAA-jaE.jpg,0.733942,samoyed,2017-07-18 00:07:08,30081,5852,7523763,140516
2017-07-17 16:17:36,886983233522544640,iPhone,This is Maya. She's very shy. Rarely leaves her cup. 13/10 would find her an environment to thrive in,13.0,10.0,Maya,,17-07-2017,16:17,1.3,https://pbs.twimg.com/media/DE8yicJW0AAAvBJ.jpg,0.793469,chihuahua,2017-07-17 16:17:36,34585,7626,7523763,140516
2017-07-16 23:58:41,886736880519319552,iPhone,"This is Mingus. He's a wonderful father to his smol pup. Confirmed 13/10, but he needs your help

https://t.co/bVi0Yr4Cff",13.0,10.0,Mingus,,16-07-2017,23:58,1.3,https://pbs.twimg.com/media/DE5Se8FXcAAJFx4.jpg,0.309706,kuvasz,2017-07-16 23:58:41,11858,3221,7523763,140516
2017-07-16 20:14:00,886680336477933568,iPhone,This is Derek. He's late for a dog meeting. 13/10 pet...al to the metal,13.0,10.0,Derek,,16-07-2017,20:14,1.3,https://pbs.twimg.com/media/DE4fEDzWAAAyHMM.jpg,0.738995,convertible,2017-07-16 20:14:00,22072,4379,7523763,140516
2017-07-15 23:25:31,886366144734445568,iPhone,This is Roscoe. Another pupper fallen victim to spontaneous tongue ejections. Get the BlepiPen immediate. 12/10 deep breaths Roscoe,12.0,10.0,Roscoe,pupper,15-07-2017,23:25,1.2,https://pbs.twimg.com/media/DE0BTnQUwAApKEH.jpg,0.999201,french bulldog,2017-07-15 23:25:31,20847,3141,7523763,140516
2017-07-14 22:10:11,885984800019947520,iPhone,Viewer discretion advised. This is Jimbo. He will rip ur finger right h*ckin off. Other dog clearly an accessory. 12/10 pls pet with caution,12.0,10.0,Jimbo,,14-07-2017,22:10,1.2,https://pbs.twimg.com/media/DEumeWWV0AA-Z61.jpg,0.972494,blenheim spaniel,2017-07-14 22:10:11,32118,6665,7523763,140516
2017-07-13 15:58:47,885528943205470208,iPhone,This is Maisey. She fell asleep mid-excavation. Happens to the best of us. 13/10 would pat noggin approvingly,13.0,10.0,Maisey,,13-07-2017,15:58,1.3,https://pbs.twimg.com/media/DEoH3yvXgAAzQtS.jpg,0.369275,pug,2017-07-13 15:58:47,35389,6316,7523763,140516
2017-07-12 16:03:00,885167619883638784,iPhone,Here we have a corgi undercover as a malamute. Pawbably doing important investigative work. Zero control over tongue happenings. 13/10,13.0,10.0,,,12-07-2017,16:03,1.3,https://pbs.twimg.com/media/DEi_N9qXYAAgEEw.jpg,0.8124819999999999,malamute,2017-07-12 16:03:00,21571,4300,7523763,140516
2017-07-11 00:00:02,884562892145688576,iPhone,This is Kevin. He's just so happy. 13/10 what is your secret Kevin,13.0,10.0,Kevin,,11-07-2017,00:00,1.3,https://pbs.twimg.com/media/DEaZQkfXUAEC7qB.jpg,0.5464060000000001,pug,2017-07-11 00:00:02,23914,4646,7523763,140516
2017-07-10 15:58:53,884441805382717440,iPhone,"I present to you, Pup in Hat. Pup in Hat is great for all occasions. Extremely versatile. Compact as h*ck. 14/10 (IG: itselizabethgales)",14.0,10.0,,,10-07-2017,15:58,1.4,https://pbs.twimg.com/media/DEYrIZwWsAA2Wo5.jpg,0.993225,pembroke,2017-07-10 15:58:53,26549,5554,7523763,140516
2017-07-08 00:28:19,883482846933004288,iPhone,"This is Bella. She hopes her smile made you smile. If not, she is also offering you her favorite monkey. 13.5/10",5.0,10.0,Bella,,08-07-2017,00:28,0.5,https://pbs.twimg.com/media/DELC9dZXUAADqUk.jpg,0.943082,golden retriever,2017-07-08 00:28:19,45175,9768,7523763,140516
2017-07-07 00:17:54,883117836046086144,iPhone,"Please only send dogs. We don't rate mechanics, no matter how h*ckin good. Thank you... 13/10 would sneak a pat",13.0,10.0,,,07-07-2017,00:17,1.3,https://pbs.twimg.com/media/DEF2-_hXoAAs62q.jpg,0.949562,golden retriever,2017-07-07 00:17:54,36574,6550,7523763,140516
2017-07-06 15:58:11,882992080364220416,iPhone,This is Rusty. He wasn't ready for the first pic. Clearly puppared for the second. 13/10 confirmed great boy,13.0,10.0,Rusty,,06-07-2017,15:58,1.3,https://pbs.twimg.com/media/DEEEnIqXYAAiJh_.jpg,0.466778,eskimo dog,2017-07-06 15:58:11,23580,3857,7523763,140516
2017-07-06 00:46:41,882762694511734784,iPhone,This is Gus. He's quite the cheeky pupper. Already perfected the disinterested wink. 12/10 would let steal my girl,12.0,10.0,Gus,pupper,06-07-2017,00:46,1.2,https://pbs.twimg.com/media/DEAz_HHXsAA-p_z.jpg,0.85005,labrador retriever,2017-07-06 00:46:41,27850,4830,7523763,140516
2017-07-05 15:48:34,882627270321602560,iPhone,This is Stanley. He has his first swim lesson today. Doggle straps adjusted. Ready to go. 13/10 Phelps is nervous (IG: stanleythe_corgi),13.0,10.0,Stanley,,05-07-2017,15:48,1.3,https://pbs.twimg.com/media/DD-40X3WAAAJPU5.jpg,0.542982,pembroke,2017-07-05 15:48:34,27475,5984,7523763,140516
2017-07-04 16:01:23,882268110199369728,iPhone,This is Alfy. You're witnessing his first watermelon experience. I think it was a success. 13/10 happy 4th Alfy ðŸ‡ºðŸ‡¸,13.0,10.0,Alfy,,04-07-2017,16:01,1.3,https://pbs.twimg.com/media/DD5yKdPW0AArzX8.jpg,0.762211,golden retriever,2017-07-04 16:01:23,44233,11394,7523763,140516
2017-07-03 00:11:11,881666595344535552,iPhone,This is Gary. He couldn't miss this puppertunity for a selfie. Flawless focusing skills. 13/10 would boop intensely,13.0,10.0,Gary,,03-07-2017,00:11,1.3,https://pbs.twimg.com/media/DDxPFwbWAAEbVVR.jpg,0.529012,saluki,2017-07-03 00:11:11,49797,10487,7523763,140516
2017-07-01 21:49:04,881268444196462592,iPhone,Meet Elliot. He's a Canadian Forrest Pup. Unusual number of antlers for a dog. Sneaky tongue slip to celebrate #Canada150. 12/10 would pet,12.0,10.0,Elliot,,01-07-2017,21:49,1.2,https://pbs.twimg.com/media/DDrk-f9WAAI-WQv.jpg,0.473303,tusker,2017-07-01 21:49:04,22726,5086,7523763,140516
2017-06-30 19:35:32,880872448815771648,iPhone,Ugh not again. We only rate dogs. Please don't send in well-dressed  floppy-tongued street penguins. Dogs only please. Thank you... 12/10,12.0,10.0,,,30-06-2017,19:35,1.2,https://pbs.twimg.com/media/DDl8zzJW0AAisCJ.jpg,0.791416,pembroke,2017-06-30 19:35:32,20937,3753,7523763,140516
2017-06-29 16:39:47,880465832366813184,iPhone,This is Bella. She had her first beach experience this morning. Complete success. 12/10 would perform a sandy boop,12.0,10.0,Bella,,29-06-2017,16:39,1.2,https://pbs.twimg.com/media/DDgK-J4XUAIEV9W.jpg,0.913255,golden retriever,2017-06-29 16:39:47,28076,6171,7523763,140516
2017-06-29 00:27:25,880221127280381952,iPhone,Meet Jesse. He's a Fetty Woof. His tongue ejects without warning. A true bleptomaniac. 12/10 would snug well,12.0,10.0,Jesse,,29-06-2017,00:27,1.2,https://pbs.twimg.com/media/DDcscbXU0AIfDzs.jpg,0.238525,chihuahua,2017-06-29 00:27:25,26630,4147,7523763,140516
2017-06-28 00:42:13,879862464715927552,iPhone,This is Romeo. He would like to do an entrance. Requesting your immediate assistance. 13/10,13.0,10.0,Romeo,,28-06-2017,00:42,1.3,https://pbs.twimg.com/media/DDXmPrbWAAEKMvy.jpg,0.813507,basset,2017-06-28 00:42:13,21969,3444,7523763,140516
2017-06-27 00:10:17,879492040517615616,iPhone,This is Bailey. He thinks you should measure ear length for signs of growth instead. 12/10,12.0,10.0,Bailey,,27-06-2017,00:10,1.2,https://pbs.twimg.com/media/DDSVWMvXsAEgmMK.jpg,0.479896,german short-haired pointer,2017-06-27 00:10:17,23064,3135,7523763,140516
2017-06-26 16:31:08,879376492567855104,iPhone,This is Jack AKA Stephen Furry. You're not scoring on him. Unless he slips down the slide. 12/10 would happily get blocked by,12.0,10.0,Jack,,26-06-2017,16:31,1.2,https://pbs.twimg.com/media/DDQsQGFV0AAw6u9.jpg,0.663601,tricycle,2017-06-26 16:31:08,16520,3068,7523763,140516
2017-06-25 18:56:45,879050749262655488,iPhone,This is Steven. He has trouble relating to other dogs. Quite shy. Neck longer than average. Tropical probably. 11/10 would still pet,11.0,10.0,Steven,,25-06-2017,18:56,1.1,https://pbs.twimg.com/media/DDMD_phXoAQ1qf0.jpg,0.311861,tabby,2017-06-25 18:56:45,22212,4646,7523763,140516
2017-06-23 16:00:04,878281511006478336,iPhone,"Meet Shadow. In an attempt to reach maximum zooming borkdrive, he tore his ACL. Still 13/10 tho. Help him out below

https://t.co/245xJJElsY",13.0,10.0,Shadow,,23-06-2017,16:00,1.3,https://pbs.twimg.com/media/DDBIX9QVYAAohGa.jpg,0.32042,basset,2017-06-23 16:00:04,7630,1268,7523763,140516
2017-06-23 01:10:23,878057613040115712,iPhone,This is Emmy. She was adopted today. Massive round of pupplause for Emmy and her new family. 14/10 for all involved,14.0,10.0,Emmy,,23-06-2017,01:10,1.4,https://pbs.twimg.com/media/DC98vABUIAA97pz.jpg,0.839097,french bulldog,2017-06-23 01:10:23,41402,6718,7523763,140516
2017-06-22 03:54:17,877736472329191424,iPhone,This is Aja. She was just told she's a good dog. Suspicions confirmed. 13/10 would tell again,13.0,10.0,Aja,,22-06-2017,03:54,1.3,https://pbs.twimg.com/media/DC5YqoQW0AArOLH.jpg,0.8379559999999999,chesapeake bay retriever,2017-06-22 03:54:17,78582,18809,7523763,140516
2017-06-21 15:58:08,877556246731214848,iPhone,This is Penny. She's both pupset and fired pup. Not pleased w your barbaric attempts at cleanliness. 12/10 would enjoy more shampoo options,12.0,10.0,Penny,,21-06-2017,15:58,1.2,https://pbs.twimg.com/media/DC20wEcW0AAf59m.jpg,0.995368,basset,2017-06-21 15:58:08,22380,3753,7523763,140516
2017-06-20 16:29:50,877201837425926144,iPhone,This is Nelly. He graduated with his dogtorate today. Wants to know if you're proud of him. 12/10 would give congratulatory boop,12.0,10.0,Nelly,,20-06-2017,16:29,1.2,https://pbs.twimg.com/media/DCxyahJWsAAddSC.jpg,0.93112,pembroke,2017-06-20 16:29:50,26728,5505,7523763,140516
2017-06-19 16:24:33,876838120628539392,iPhone,This is Ginger. She's having a ruff Monday. Too many pupper things going on. H*ckin exhausting. 12/10 would snug passionately,12.0,10.0,Ginger,pupper,19-06-2017,16:24,1.2,https://pbs.twimg.com/media/DCsnnZsVwAEfkyi.jpg,0.575751,bloodhound,2017-06-19 16:24:33,20382,3296,7523763,140516
2017-06-18 16:57:37,876484053909872640,iPhone,This is Benedict. He wants to thank you for this delightful urban walk. Hopes you know he loves you. 13/10 super duper good boy,13.0,10.0,Benedict,,18-06-2017,16:57,1.3,https://pbs.twimg.com/media/DCnll_dUQAAkBdG.jpg,0.874566,golden retriever,2017-06-18 16:57:37,18488,2365,7523763,140516
2017-06-17 16:52:05,876120275196170240,iPhone,"Meet Venti, a seemingly caffeinated puppoccino. She was just informed the weekend would include walks, pats and scritches. 13/10 much excite",13.0,10.0,Venti,,17-06-2017,16:52,1.3,https://pbs.twimg.com/media/DCiavj_UwAAcXep.jpg,0.534327,bernese mountain dog,2017-06-17 16:52:05,27510,4631,7523763,140516
2017-06-16 16:11:53,875747767867523072,iPhone,"This is Goose. He's a womanizer. Cheeky as h*ck, but also deep. Tongue slip game on another level. 13/10 will steal your girl",13.0,10.0,Goose,,16-06-2017,16:11,1.3,https://pbs.twimg.com/media/DCdH8YpUQAAiEbL.jpg,0.799551,labrador retriever,2017-06-16 16:11:53,24839,4240,7523763,140516
2017-06-15 00:13:52,875144289856114688,iPhone,Meet Nugget and Hank. Nugget took Hank's bone. Hank is wondering if you would please return it to him. Both 13/10 would not intervene,13.0,10.0,Nugget,,15-06-2017,00:13,1.3,https://pbs.twimg.com/ext_tw_video_thumb/875144175078957056/pu/img/BRi_l7vUdpb93Knf.jpg,0.245048,siberian husky,2017-06-15 00:13:52,21603,4863,7523763,140516
2017-06-14 16:04:48,875021211251597312,iPhone,Guys please stop sending pictures without any dogs in th- oh never mind hello excuse me sir. 12/10 stealthy as h*ck,12.0,10.0,,,14-06-2017,16:04,1.2,https://pbs.twimg.com/media/DCSzF3NVoAAPzT4.jpg,0.7143189999999999,west highland white terrier,2017-06-14 16:04:48,25102,4662,7523763,140516
2017-06-13 17:29:20,874680097055178752,iPhone,Meet Cash. He hath acquired a stick. A very good stick tbh. 12/10 would pat head approvingly,12.0,10.0,Cash,,13-06-2017,17:29,1.2,https://pbs.twimg.com/media/DCN85nGUwAAzG_q.jpg,0.836052,labrador retriever,2017-06-13 17:29:20,27435,4591,7523763,140516
2017-06-12 16:06:11,874296783580663808,iPhone,This is Jed. He may be the fanciest pupper in the game right now. Knows it too. 13/10 would sign modeling contract,13.0,10.0,Jed,pupper,12-06-2017,16:06,1.3,https://pbs.twimg.com/media/DCIgSR0XgAANEOY.jpg,0.437216,cocker spaniel,2017-06-12 16:06:11,25706,4063,7523763,140516
2017-06-12 00:15:36,874057562936811520,iPhone,"I can't believe this keeps happening. This, is a birb taking a bath. We only rate dogs. Please only send dogs. Thank you... 12/10",12.0,10.0,,,12-06-2017,00:15,1.2,https://pbs.twimg.com/media/DCFGtdoXkAEsqIw.jpg,0.8321770000000001,flat-coated retriever,2017-06-12 00:15:36,22349,3916,7523763,140516
2017-06-11 21:18:31,874012996292530176,iPhone,"This is Sebastian. He can't see all the colors of the rainbow, but he can see that this flag makes his human happy. 13/10 #PrideMonth puppo",13.0,10.0,Sebastian,puppo,11-06-2017,21:18,1.3,https://pbs.twimg.com/media/DCEeLxjXsAAvNSM.jpg,0.806674,cardigan,2017-06-11 21:18:31,34121,10302,7523763,140516
2017-06-09 16:22:42,873213775632977920,iPhone,"This is Sierra. She's one precious pupper. Absolute 12/10. Been in and out of ICU her whole life. Help Sierra below

https://t.co/Xp01EU3qyD",12.0,10.0,Sierra,pupper,09-06-2017,16:22,1.2,https://pbs.twimg.com/media/DB5HTBGXUAE0TiK.jpg,0.6197819999999999,vizsla,2017-06-09 16:22:42,7140,1570,7523763,140516
2017-06-09 00:02:31,872967104147763200,iPhone,Here's a very large dog. He has a date later. Politely asked this water person to check if his breath is bad. 12/10 good to go doggo,12.0,10.0,,doggo,09-06-2017,00:02,1.2,https://pbs.twimg.com/media/DB1m871XUAAw5vZ.jpg,0.476913,labrador retriever,2017-06-09 00:02:31,27025,5361,7523763,140516
2017-06-08 14:20:41,872820683541237760,iPhone,"Here are my favorite #dogsatpollingstations 
Most voted for a more consistent walking schedule and to increase daily pats tenfold. All 13/10",13.0,10.0,,,08-06-2017,14:20,1.3,https://pbs.twimg.com/media/DBzhx0PWAAEhl0E.jpg,0.99912,pug,2017-06-08 14:20:41,14533,3664,7523763,140516
2017-06-08 01:06:27,872620804844003328,iPhone,This is Monkey. She's supporting owners everywhere with her fancy #PrideMonth bandana. 13/10 love is love is love...,13.0,10.0,Monkey,,08-06-2017,01:06,1.3,https://pbs.twimg.com/media/DBwr_hzXkAEnZBW.jpg,0.513191,cocker spaniel,2017-06-08 01:06:27,20546,3663,7523763,140516
2017-06-07 16:14:40,872486979161796608,iPhone,We. Only. Rate. Dogs. Do not send in other things like this fluffy floor shark clearly ready to attack. Get it together guys... 12/10,12.0,10.0,,,07-06-2017,16:14,1.2,https://pbs.twimg.com/media/DBuyRlTUwAAYhG9.jpg,0.931861,pembroke,2017-06-07 16:14:40,40211,8951,7523763,140516
2017-06-03 00:48:22,870804317367881728,iPhone,Real funny guys. Sending in a pic without a dog in it. Hilarious. We'll rate the rug tho because it's giving off a very good vibe. 11/10,11.0,10.0,,,03-06-2017,00:48,1.1,https://pbs.twimg.com/media/DBW35ZsVoAEWZUU.jpg,0.16829000000000002,home theater,2017-06-03 00:48:22,33316,6183,7523763,140516
2017-06-01 20:18:38,870374049280663552,iPhone,This is Zoey. She really likes the planet. Would hate to see willful ignorance and the denial of fairly elemental science destroy it. 13/10,13.0,10.0,Zoey,,01-06-2017,20:18,1.3,https://pbs.twimg.com/media/DBQwlFCXkAACSkI.jpg,0.841001,golden retriever,2017-06-01 20:18:38,82091,26158,7523763,140516
2017-05-31 04:27:59,869772420881756160,iPhone,"This is Dewey (pronounced ""covfefe""). He's having a good walk. Arguably the best walk. 13/10 would snug softly",13.0,10.0,Dewey,,31-05-2017,04:27,1.3,https://pbs.twimg.com/media/DBINZcxXgAQ-R6P.jpg,0.980148,pembroke,2017-05-31 04:27:59,42130,10026,7523763,140516
2017-05-29 16:24:37,869227993411051520,iPhone,This is Gizmo. His favorite thing is standing pupright like a hooman. Sneaky tongue slip status achieved. 13/10 would boop well,13.0,10.0,Gizmo,,29-05-2017,16:24,1.3,https://pbs.twimg.com/media/DBAePiVXcAAqHSR.jpg,0.664181,pembroke,2017-05-29 16:24:37,20325,3788,7523763,140516
2017-05-28 00:18:35,868622495443632128,iPhone,Here's a h*ckin peaceful boy. Unbothered by the comings and goings. 13/10 please reveal your wise ways,13.0,10.0,,,28-05-2017,00:18,1.3,https://pbs.twimg.com/media/DA33i0XXsAEQtCA.jpg,0.868107,labrador retriever,2017-05-28 00:18:35,26709,5390,7523763,140516
2017-05-27 19:39:34,868552278524837888,iPhone,"Say hello to Cooper. His expression is the same wet or dry. Absolute 12/10 but Coop desperately requests your help

https://t.co/ZMTE4Mr69f",12.0,10.0,Cooper,,27-05-2017,19:39,1.2,https://pbs.twimg.com/media/DA23sCeVoAE3uF0.jpg,0.378151,whippet,2017-05-27 19:39:34,10095,2102,7523763,140516
2017-05-26 00:29:37,867900495410671616,iPhone,"Unbelievable. We only rate dogs. Please don't send in non-canines like the ""I"" from Pixar's opening credits. Thank you... 12/10",12.0,10.0,,,26-05-2017,00:29,1.2,https://pbs.twimg.com/media/DAtm5MkXoAA4R6P.jpg,0.522644,labrador retriever,2017-05-26 00:29:37,24114,4193,7523763,140516
2017-05-23 16:16:06,867051520902168576,iPhone,"Oh my this spooked me up. We only rate dogs, not happy ghosts. Please send dogs only. It's a very simple premise. Thank you... 13/10",13.0,10.0,,,23-05-2017,16:16,1.3,https://pbs.twimg.com/media/DAhiwb0XcAA8x5Q.jpg,0.471403,samoyed,2017-05-23 16:16:06,32180,7912,7523763,140516
2017-05-22 16:06:55,866686824827068416,iPhone,This is Lili. She can't believe you betrayed her with bath time. Never looking you in the eye again. 12/10 would puppologize profusely,12.0,10.0,Lili,,22-05-2017,16:06,1.2,https://pbs.twimg.com/media/DAcXEWuXkAIBDGJ.jpg,0.51473,flat-coated retriever,2017-05-22 16:06:55,19309,3509,7523763,140516
2017-05-19 23:57:46,865718153858494464,iPhone,"Meet Boomer. He's just checking pup on you. Hopes you had a good day. If not, he hopes he made it better. 13/10 extremely good boy",13.0,10.0,Boomer,,19-05-2017,23:57,1.3,https://pbs.twimg.com/media/DAOmEZiXYAAcv2S.jpg,0.673664,golden retriever,2017-05-19 23:57:46,25645,5661,7523763,140516
2017-05-19 00:12:11,865359393868664832,iPhone,This is Sammy. Her tongue ejects without warning sometimes. It's a serious condition. Needs a hefty dose from a BlepiPen. 13/10,13.0,10.0,Sammy,,19-05-2017,00:12,1.3,https://pbs.twimg.com/media/DAJfxqGVoAAnvQt.jpg,0.832435,chesapeake bay retriever,2017-05-19 00:12:11,26504,5045,7523763,140516
2017-05-18 00:50:50,865006731092295680,iPhone,This is Nelly. He really hopes you like his Hawaiian shirt. He already tore the tags off. 13/10 h*ck of a puppurchase,13.0,10.0,Nelly,,18-05-2017,00:50,1.3,https://pbs.twimg.com/media/DAEfCFXUIAA1uqj.jpg,0.989882,pembroke,2017-05-18 00:50:50,28041,7762,7523763,140516
2017-05-17 16:00:15,864873206498414592,iPhone,We only rate dogs. Please don't send in Jesus. We're trying to remain professional and legitimate. Thank you... 14/10,14.0,10.0,,,17-05-2017,16:00,1.4,https://pbs.twimg.com/media/DAClmHkXcAA1kSv.jpg,0.478616,pole,2017-05-17 16:00:15,32357,8789,7523763,140516
2017-05-16 00:41:21,864279568663928832,iPhone,This is Meatball. He doing what's known in the industry as a mid-strut mlem. H*ckin fancy boy. 12/10 I'd do anything for Meatball,12.0,10.0,Meatball,,16-05-2017,00:41,1.2,https://pbs.twimg.com/media/C_6JrWZVwAAHhCD.jpg,0.668613,bull mastiff,2017-05-16 00:41:21,14661,3070,7523763,140516
2017-05-15 19:14:50,864197398364647424,iPhone,This is Paisley. She ate a flower just to prove she could. Savage af. 13/10 would pet so well,13.0,10.0,Paisley,,15-05-2017,19:14,1.3,https://pbs.twimg.com/media/C_4-8iPV0AA1Twg.jpg,0.945905,golden retriever,2017-05-15 19:14:50,30257,9037,7523763,140516
2017-05-12 16:05:02,863062471531167744,iPhone,"Say hello to Quinn. She's quite the goofball. Not even a year old. Confirmed 13/10 but she really needs your help 

https://t.co/MOBkQnyHib",13.0,10.0,Quinn,,12-05-2017,16:05,1.3,https://pbs.twimg.com/media/C_o2vKCUwAAgtOp.jpg,0.935804,french bulldog,2017-05-12 16:05:02,8569,2486,7523763,140516
2017-05-12 00:46:44,862831371563274240,iPhone,"This is Zooey. She's the world's biggest fan of illiterate delivery people. 13/10 not your fault they don't listen, Zooey",13.0,10.0,Zooey,,12-05-2017,00:46,1.3,https://pbs.twimg.com/media/C_lkieeVwAAm0L4.jpg,0.207281,australian terrier,2017-05-12 00:46:44,19257,5162,7523763,140516
2017-05-11 00:01:27,862457590147678208,iPhone,"This is Jersey. He likes to watch movies, but only if you watch with him. Enjoys horror films like The Bababork and H*ckraiser. 13/10",13.0,10.0,Jersey,,11-05-2017,00:01,1.3,https://pbs.twimg.com/media/C_gQmaTUMAAPYSS.jpg,0.496348,home theater,2017-05-11 00:01:27,20659,5037,7523763,140516
2017-05-10 00:08:34,862096992088072192,iPhone,We only rate dogs. Please don't send perfectly toasted marshmallows attempting to drive. Thank you... 13/10,13.0,10.0,,,10-05-2017,00:08,1.3,https://pbs.twimg.com/media/C_bIo7QXYAAGfPu.jpg,0.677589,chow,2017-05-10 00:08:34,75003,23654,7523763,140516
2017-05-08 00:54:59,861383897657036800,iPhone,This is Hobbes. He's never seen bubbles before. 13/10 deep breaths buddy,13.0,10.0,Hobbes,,08-05-2017,00:54,1.3,https://pbs.twimg.com/media/C_RAFTxUAAAbXjV.jpg,0.771008,cardigan,2017-05-08 00:54:59,36322,10881,7523763,140516
2017-05-05 16:00:04,860524505164394496,iPhone,This is Carl. He likes to dance. Doesn't care what you think about it. 13/10 h*ckin confident pup,13.0,10.0,Carl,,05-05-2017,16:00,1.3,https://pbs.twimg.com/media/C_EyeKuXkAAdxY-.jpg,0.286558,bedlington terrier,2017-05-05 16:00:04,23817,5376,7523763,140516
2017-05-04 23:34:55,860276583193509888,iPhone,This is Jordy. He likes to go on adventures and watch the small scaly underwater dogs with fins pass him by. 12/10 peaceful as h*ck,12.0,10.0,Jordy,,04-05-2017,23:34,1.2,https://pbs.twimg.com/media/C_BQ_NlVwAAgYGD.jpg,0.312299,lakeside,2017-05-04 23:34:55,18452,3544,7523763,140516
2017-05-04 17:30:24,860184849394610176,iPhone,"Here we have perhaps the wisest dog of all. Above average with light sabers. Immortal as h*ck. 14/10 dog, or dog not, there is no try",14.0,10.0,,,04-05-2017,17:30,1.4,https://pbs.twimg.com/media/C-_9jWWUwAAnwkd.jpg,0.267612,chimpanzee,2017-05-04 17:30:24,16834,5955,7523763,140516
2017-05-04 00:15:58,859924526012018688,iPhone,Meet Milky. She has no idea what happened. Just as pupset as you. Perhaps a sheep exploded. Even offered to help clean. 12/10 very good girl,12.0,10.0,Milky,,04-05-2017,00:15,1.2,https://pbs.twimg.com/media/C-8QypZXcAAekaF.jpg,0.254587,french bulldog,2017-05-04 00:15:58,19727,4182,7523763,140516
2017-05-03 03:17:27,859607811541651456,iPhone,Sorry for the lack of posts today. I came home from school and had to spend quality time with my puppo. Her name is Zoey and she's 13/10,13.0,10.0,,puppo,03-05-2017,03:17,1.3,https://pbs.twimg.com/media/C-3wvtxXcAUTuBE.jpg,0.8955290000000001,golden retriever,2017-05-03 03:17:27,18767,1608,7523763,140516
2017-05-02 00:04:57,859196978902773760,iPhone,We only rate dogs. This is quite clearly a smol broken polar bear. We'd appreciate if you only send dogs. Thank you... 12/10,12.0,10.0,,,02-05-2017,00:04,1.2,https://pbs.twimg.com/ext_tw_video_thumb/859196962498805762/pu/img/-yBpr4-o4GJZECYE.jpg,0.224218,angora,2017-05-02 00:04:57,90891,30876,7523763,140516
2017-05-01 00:40:27,858843525470990336,iPhone,I have stumbled puppon a doggo painting party. They're looking to be the next Pupcasso or Puppollock. All 13/10 would put it on the fridge,13.0,10.0,,doggo,01-05-2017,00:40,1.3,https://pbs.twimg.com/media/C-s5oYZXkAAMHHq.jpg,0.57812,golden retriever,2017-05-01 00:40:27,15706,3557,7523763,140516
2017-04-30 00:02:42,858471635011153920,iPhone,This is Sophie. She just arrived. Used pawority shipping. Speedy as h*ck delivery. 13/10 would carefully assemble,13.0,10.0,Sophie,,30-04-2017,00:02,1.3,https://pbs.twimg.com/media/C-nnZBdXkAAB-wg.jpg,0.987407,pembroke,2017-04-30 00:02:42,21749,4961,7523763,140516
2017-04-28 23:57:28,858107933456039936,iPhone,This is Wyatt. He had an interview earlier today. Was just told he didn't get the job. A h*ckin injustice. Still 12/10 keep your chin pup,12.0,10.0,Wyatt,,28-04-2017,23:57,1.2,https://pbs.twimg.com/media/C-icm_WXUAAmuRR.jpg,0.863874,golden retriever,2017-04-28 23:57:28,15909,2984,7523763,140516
2017-04-28 16:08:49,857989990357356544,iPhone,This is Rosie. She was just informed of the walk that's about to happen. Knows there are many a stick along the way. 12/10 such excite,12.0,10.0,Rosie,,28-04-2017,16:08,1.2,https://pbs.twimg.com/media/C-gxV9ZXkAIBL-S.jpg,0.43258,french bulldog,2017-04-28 16:08:49,16323,2646,7523763,140516
2017-04-28 00:00:54,857746408056729600,iPhone,Meet Thor. He doesn't have finals because he's a dog but is pupset you have finals. Just wants to play. 13/10 would abandon education for,13.0,10.0,Thor,,28-04-2017,00:00,1.3,https://pbs.twimg.com/media/C-dTzBzXUAQRjYz.jpg,0.919832,labrador retriever,2017-04-28 00:00:54,34718,10918,7523763,140516
2017-04-26 16:00:39,857263160327368704,iPhone,This is Oscar and Oliver. Oliver shrunk Oscar. Oscar isn't pleased about it. Quite pupset tbh. Oliver doesn't seem to mind. Both 13/10,13.0,10.0,Oscar,,26-04-2017,16:00,1.3,https://pbs.twimg.com/media/C-WcS4MXoAADrBU.jpg,0.998021,samoyed,2017-04-26 16:00:39,20282,4647,7523763,140516
2017-04-26 00:33:27,857029823797047296,iPhone,This is Zeke. He performs group cheeky wink tutorials. Pawfect execution here. 12/10 would wink back,12.0,10.0,Zeke,,26-04-2017,00:33,1.2,https://pbs.twimg.com/media/C-TIEwMW0AEjb55.jpg,0.968623,golden retriever,2017-04-26 00:33:27,19208,4119,7523763,140516
2017-04-24 16:22:16,856543823941562368,iPhone,This is Callie. She'll be your navigator today. Takes her job very seriously. Will shift for you. One ear always in the pupholder. 12/10,12.0,10.0,Callie,,24-04-2017,16:22,1.2,https://pbs.twimg.com/media/C-MOEDCXYAEjp7o.jpg,0.30691,boston bull,2017-04-24 16:22:16,16508,2966,7523763,140516
2017-04-24 15:13:52,856526610513747968,iPhone,"THIS IS CHARLIE, MARK. HE DID JUST WANT TO SAY HI AFTER ALL. PUPGRADED TO A 14/10. WOULD BE AN HONOR TO FLY WITH",14.0,10.0,,,24-04-2017,15:13,1.4,https://pbs.twimg.com/media/C-L-aIYXgAIR0jY.jpg,0.798481,old english sheepdog,2017-04-24 15:13:52,12020,1939,7523763,140516
2017-04-23 23:01:59,856282028240666624,iPhone,"This is Cermet, Paesh, and Morple. They are absolute h*ckin superstars. Watered every day so they can grow. 14/10 for all",14.0,10.0,Cermet,,23-04-2017,23:01,1.4,https://pbs.twimg.com/media/C-If9ZwXoAAfDX2.jpg,0.8765430000000001,chihuahua,2017-04-23 23:01:59,28177,6518,7523763,140516
2017-04-22 18:31:02,855851453814013952,iPhone,Here's a puppo participating in the #ScienceMarch. Cleverly disguising her own doggo agenda. 13/10 would keep the planet habitable for,13.0,10.0,,"puppo, doggo",22-04-2017,18:31,1.3,https://pbs.twimg.com/media/C-CYWrvWAAU8AXH.jpg,0.321676,flat-coated retriever,2017-04-22 18:31:02,46211,18289,7523763,140516
2017-04-21 16:33:22,855459453768019968,iPhone,"Guys, we only rate dogs. This is quite clearly a bulbasaur. Please only send dogs. Thank you... 12/10 human used pet, it's super effective",12.0,10.0,,,21-04-2017,16:33,1.2,https://pbs.twimg.com/media/C98z1ZAXsAEIFFn.jpg,0.389513,blenheim spaniel,2017-04-21 16:33:22,30492,8499,7523763,140516
2017-04-19 16:25:34,854732716440526848,iPhone,This is Marlee. She fetched a flower and immediately requested that it be placed behind her ear. 12/10 elegant af,12.0,10.0,Marlee,,19-04-2017,16:25,1.2,https://pbs.twimg.com/media/C9ye3b3WAAAlTo0.jpg,0.6955479999999999,pembroke,2017-04-19 16:25:34,23317,6341,7523763,140516
2017-04-18 23:50:52,854482394044301312,iPhone,This is Arya. She can barely contain her excitement for more peanut butter. Also patriotic af. 13/10,13.0,10.0,Arya,,18-04-2017,23:50,1.3,https://pbs.twimg.com/media/C9u7MtmV0AA741s.jpg,0.26024200000000003,chihuahua,2017-04-18 23:50:52,29932,7133,7523763,140516
2017-04-18 16:05:17,854365224396361728,iPhone,This is Einstein. He's having a really good day. Hopes you are too. H*ckin nifty tongue. 13/10 would snug intensely,13.0,10.0,Einstein,,18-04-2017,16:05,1.3,https://pbs.twimg.com/media/C9tQokgUIAEETSx.jpg,0.90708,pembroke,2017-04-18 16:05:17,19306,4872,7523763,140516
2017-04-17 16:34:26,854010172552949760,iPhone,"At first I thought this was a shy doggo, but it's actually a Rare Canadian Floofer Owl. Amateurs would confuse the two. 11/10 only send dogs",11.0,10.0,,"floofer, doggo",17-04-2017,16:34,1.1,https://pbs.twimg.com/media/C9oNt91WAAAFSLS.jpg,0.354733,english springer,2017-04-17 16:34:26,16567,3284,7523763,140516
2017-04-16 16:00:07,853639147608842240,iPhone,A photographer took pictures before and after he told his bunny he's a good boy. Here are the results. 13/10,13.0,10.0,,,16-04-2017,16:00,1.3,https://pbs.twimg.com/media/C9i8RhhXoAAdkMT.jpg,0.509879,german shepherd,2017-04-16 16:00:07,35713,10574,7523763,140516
2017-04-15 17:32:18,853299958564483072,iPhone,This is Rumpole. He'll be your Uber driver this evening. Won't start driving until you buckle pup. 13/10 h*ckin safe good boy,13.0,10.0,Rumpole,,15-04-2017,17:32,1.3,https://pbs.twimg.com/media/C9eHyF7XgAAOxPM.jpg,0.65228,grille,2017-04-15 17:32:18,15921,3730,7523763,140516
2017-04-14 15:51:39,852912242202992640,iPhone,"Meet Benny. He likes being adorable and making fun of you while you're on the trampoline. 12/10 let's help him out

https://t.co/aVMjBqAy1x",12.0,10.0,Benny,,14-04-2017,15:51,1.2,https://pbs.twimg.com/media/C9YnKK3VoAAxn1E.jpg,0.7837649999999999,great dane,2017-04-14 15:51:39,9299,1918,7523763,140516
2017-04-13 23:59:28,852672615818899456,iPhone,This is Aspen. She's never tasted a stick so succulent. On the verge of tears. A face of pure appreciation. 12/10,12.0,10.0,Aspen,,13-04-2017,23:59,1.2,https://pbs.twimg.com/media/C9VNNp1XkAEWRFb.jpg,0.7112350000000001,golden retriever,2017-04-13 23:59:28,15311,2258,7523763,140516
2017-04-11 00:24:08,851591660324737024,iPhone,Oh jeez u did me quite the spook little fella. We normally don't rate triceratops but this one seems suspiciously good. 11/10 would pet well,11.0,10.0,,,11-04-2017,00:24,1.1,https://pbs.twimg.com/media/C9F2FG5WAAAJ0iN.jpg,0.394507,cardigan,2017-04-11 00:24:08,16684,3641,7523763,140516
2017-04-07 16:10:12,850380195714523136,iPhone,This is Leo. He's a personal triathlon coach. Currently overseeing this athlete's push-pups. H*ckin brutal. 13/10 would do all he asks of me,13.0,10.0,Leo,,07-04-2017,16:10,1.3,https://pbs.twimg.com/ext_tw_video_thumb/850380153985355777/pu/img/lFouhg-EZvJs8eMr.jpg,0.249012,yorkshire terrier,2017-04-07 16:10:12,13474,2751,7523763,140516
2017-04-07 00:38:06,850145622816686080,iPhone,This is Riley. He's making new friends. Jubilant as h*ck for the fun times ahead. 11/10 for all pups pictured,11.0,10.0,Riley,,07-04-2017,00:38,1.1,https://pbs.twimg.com/media/C8xS655XkAAv9vo.jpg,0.7147979999999999,tennis ball,2017-04-07 00:38:06,16860,4032,7523763,140516
2017-04-06 16:18:05,850019790995546112,iPhone,Say hello to Boomer. He's a sandy pupper. Having a h*ckin blast. 12/10 would pet passionately,12.0,10.0,Boomer,pupper,06-04-2017,16:18,1.2,https://pbs.twimg.com/media/C8vgfTsXgAA561h.jpg,0.759907,shetland sheepdog,2017-04-06 16:18:05,21131,5159,7523763,140516
2017-04-05 00:04:08,849412302885593088,iPhone,This is Noosh. He noticed you were in the shower and thought you could use some company. 12/10 h*ckin loyal,12.0,10.0,Noosh,,05-04-2017,00:04,1.2,https://pbs.twimg.com/media/C8m3-iQVoAAETnF.jpg,0.907559,schipperke,2017-04-05 00:04:08,16417,3313,7523763,140516
2017-04-04 19:03:06,849336543269576704,iPhone,"At first I thought this was a dog because of the sign, but it is clearly Wilson from Home Improvement. Please only send in dogs... 11/10",11.0,10.0,,,04-04-2017,19:03,1.1,https://pbs.twimg.com/media/C8lzFC4XcAAQxB4.jpg,0.521788,patio,2017-04-04 19:03:06,11822,1992,7523763,140516
2017-04-03 00:16:10,848690551926992896,iPhone,Please stop sending in animals other than dogs. We only rate dogs. Not Furry Ecuadorian Sea Turtles. Thank you... 12/10,12.0,10.0,,,03-04-2017,00:16,1.2,https://pbs.twimg.com/media/C8cnjHuXsAAoZQf.jpg,0.8236479999999999,flat-coated retriever,2017-04-03 00:16:10,26097,4564,7523763,140516
2017-04-02 00:03:26,848324959059550208,iPhone,Meet Odin. He's supposed to be giving directions but he'd rather look at u like that. Should probably buckle pup. 12/10 distracting as h*ck,12.0,10.0,Odin,,02-04-2017,00:03,1.2,https://pbs.twimg.com/media/C8XbDR1WAAAxND8.jpg,0.5445760000000001,malamute,2017-04-02 00:03:26,25645,4851,7523763,140516
2017-04-01 16:35:01,848212111729840128,iPhone,"This is Jerry. He's doing a distinguished tongue slip. Slightly patronizing tbh. You think you're better than us, Jerry? 6/10 hold me back",6.0,10.0,Jerry,,01-04-2017,16:35,0.6,https://pbs.twimg.com/media/C8V0aI5V0AAgO9m.jpg,0.333486,bedlington terrier,2017-04-01 16:35:01,16920,3250,7523763,140516
2017-04-01 00:04:17,847962785489326080,iPhone,This is Georgie. He's very shy. Only puppears when called. Aggressively average at fetch. Unique front paws. Looks slippery. 10/10 would pet,10.0,10.0,Georgie,,01-04-2017,00:04,1.0,https://pbs.twimg.com/media/C8SRpHNUIAARB3j.jpg,0.882654,sea lion,2017-04-01 00:04:17,24382,5395,7523763,140516
2017-03-31 16:07:33,847842811428974592,iPhone,"This is Rontu. He is described as a pal, cuddle bug, protector and constant shadow. 12/10, but he needs your help

https://t.co/zK4cpKPFfU",12.0,10.0,Rontu,,31-03-2017,16:07,1.2,https://pbs.twimg.com/media/C8QkidrVYAQXQh7.jpg,0.951337,bernese mountain dog,2017-03-31 16:07:33,5681,1421,7523763,140516
2017-03-30 00:56:03,847251039262605312,iPhone,This is Furzey. He's doing an elevated sandy zoom. Adjusts ears to steer. 12/10 would pet mid flight,12.0,10.0,Furzey,,30-03-2017,00:56,1.2,https://pbs.twimg.com/media/C8IKUjAUwAEP-En.jpg,0.49538,airedale,2017-03-30 00:56:03,21240,4555,7523763,140516
2017-03-27 00:15:53,846153765933735936,iPhone,This is Vixen. He really likes bananas. Steals them when he thinks nobody's watching. 13/10 opportunistic af,13.0,10.0,Vixen,,27-03-2017,00:15,1.3,https://pbs.twimg.com/media/C74kWqoU8AEaf3v.jpg,0.346468,giant schnauzer,2017-03-27 00:15:53,32989,9625,7523763,140516
2017-03-24 22:08:59,845397057150107648,iPhone,"Say hello to Mimosa. She's an emotional support doggo who helps her owner with PTSD. 13/10, but she needs your help

https://t.co/L6mLzrd7Mx",13.0,10.0,Mimosa,doggo,24-03-2017,22:08,1.3,https://pbs.twimg.com/media/C7t0IzLWkAINoft.jpg,0.394404,dandie dinmont,2017-03-24 22:08:59,7947,1923,7523763,140516
2017-03-24 16:10:40,845306882940190720,iPhone,This is Pickles. She's a silly pupper. Thinks she's a dish. 12/10 would dry,12.0,10.0,Pickles,pupper,24-03-2017,16:10,1.2,https://pbs.twimg.com/media/C7siH5DXkAACnDT.jpg,0.567475,irish water spaniel,2017-03-24 16:10:40,24282,5733,7523763,140516
2017-03-23 18:29:57,844979544864018432,iPhone,"PUPDATE: I'm proud to announce that Toby is 236 days sober. Pupgraded to a 13/10. We're all very proud of you, Toby",13.0,10.0,,,23-03-2017,18:29,1.3,https://pbs.twimg.com/media/C7n4aQ0VAAAohkL.jpg,0.999281,tennis ball,2017-03-23 18:29:57,14195,2751,7523763,140516
2017-03-23 18:07:10,844973813909606400,iPhone,"This is Brady. He's a recovering alcoholic. Demonstrating incredible restraint here. 12/10 don't give pup, don't give in, Brady",12.0,10.0,Brady,,23-03-2017,18:07,1.2,https://pbs.twimg.com/media/C7nzMwTV4AARz4t.jpg,0.742421,labrador retriever,2017-03-23 18:07:10,15751,3420,7523763,140516
2017-03-23 00:18:10,844704788403113984,iPhone,This is Luna. It's her first time outside and a bee stung her nose. Completely h*ckin uncalled for. 13/10 where's the bee I just wanna talk,13.0,10.0,Luna,,23-03-2017,00:18,1.3,https://pbs.twimg.com/media/C7j-hkSW0AIxCZC.jpg,0.980213,labrador retriever,2017-03-23 00:18:10,40366,11005,7523763,140516
2017-03-21 16:26:50,844223788422217728,iPhone,This is Margo. She just dug pup a massive hole. Can't wait for you to see it. H*ckin proud of herself. 12/10 would forgive then pet,12.0,10.0,Margo,,21-03-2017,16:26,1.2,https://pbs.twimg.com/media/C7dJCnqU4AAswat.jpg,0.71951,labrador retriever,2017-03-21 16:26:50,14215,2340,7523763,140516
2017-03-19 23:25:35,843604394117681152,iPhone,This is Hank. He's been outside for 3 minutes and already made a friend. Way to go Hank. 11/10 for both,11.0,10.0,Hank,,19-03-2017,23:25,1.1,https://pbs.twimg.com/media/C7UVuE_U0AI8GGl.jpg,0.430583,labrador retriever,2017-03-19 23:25:35,17629,2936,7523763,140516
2017-03-17 21:13:10,842846295480000512,iPhone,This is Charlie. He's wishing you a very fun and safe St. Pawtrick's Day. 13/10 festive af,13.0,10.0,Charlie,,17-03-2017,21:13,1.3,https://pbs.twimg.com/media/C7JkO0rX0AErh7X.jpg,0.461076,labrador retriever,2017-03-17 21:13:10,15897,3837,7523763,140516
2017-03-17 00:38:32,842535590457499648,iPhone,This is Winnie. She lost her body saving a children's hospital from an avalanche. 13/10 what a h*ckin hero,13.0,10.0,Winnie,,17-03-2017,00:38,1.3,https://pbs.twimg.com/media/C7FJpgVW4AIDzi6.jpg,0.685084,pembroke,2017-03-17 00:38:32,18910,3740,7523763,140516
2017-03-16 00:00:07,842163532590374912,iPhone,Meet George. He looks slightly deflated but overall quite powerful. Not sure how that human restrained him. 12/10 would snug with permission,12.0,10.0,George,,16-03-2017,00:00,1.2,https://pbs.twimg.com/media/C6_3QgMWsAMNnAk.jpg,0.891227,french bulldog,2017-03-16 00:00:07,25592,6194,7523763,140516
2017-03-13 00:02:39,841077006473256960,iPhone,This is Dawn. She's just checking pup on you. Making sure you're doing okay. 12/10 she's here if you need her,12.0,10.0,Dawn,,13-03-2017,00:02,1.2,https://pbs.twimg.com/media/C6wbE5bXUAAh1Hv.jpg,0.962985,brittany spaniel,2017-03-13 00:02:39,23937,5677,7523763,140516
2017-03-11 01:15:58,840370681858686976,iPhone,You have been visited by the magical sugar jar puggo. He has granted you three boops. 13/10 would use immediately,13.0,10.0,,,11-03-2017,01:15,1.3,https://pbs.twimg.com/media/C6mYrK0UwAANhep.jpg,0.981819,teapot,2017-03-11 01:15:58,17245,4872,7523763,140516
2017-03-10 18:27:58,840268004936019968,iPhone,This is Monty. He makes instantly regrettable decisions. Couldn't help himself. It looked like a ghost lollipop. 12/10 mistake happen,12.0,10.0,Monty,,10-03-2017,18:27,1.2,https://pbs.twimg.com/media/C6k7SaEXUAg83_J.jpg,0.8639870000000001,chesapeake bay retriever,2017-03-10 18:27:58,20198,6140,7523763,140516
2017-03-10 00:04:21,839990271299457024,iPhone,Meet Sojourner. His nose is a Fibonacci Spiral. Legendary af. 13/10 we must protect him at all costs,13.0,10.0,Sojourner,,10-03-2017,00:04,1.3,https://pbs.twimg.com/media/C6g-sX-VsAAHfJ9.jpg,0.604938,staffordshire bullterrier,2017-03-10 00:04:21,14070,2459,7523763,140516
2017-03-08 18:52:12,839549326359670784,iPhone,"Meet Winston. He knows he's a little too big for the swing, but he doesn't care. Kindly requests a push. 12/10 would happily oblige",12.0,10.0,Winston,,08-03-2017,18:52,1.2,https://pbs.twimg.com/media/C6atpTLWYAIL7bU.jpg,0.393527,swing,2017-03-08 18:52:12,28854,8340,7523763,140516
2017-03-04 00:21:08,837820167694528512,iPhone,"Here's a pupper before and after being asked ""who's a good girl?"" Unsure as h*ck. 12/10 hint hint it's you",12.0,10.0,,pupper,04-03-2017,00:21,1.2,https://pbs.twimg.com/media/C6CI_jbVAAA3-a1.jpg,0.887625,golden retriever,2017-03-04 00:21:08,35903,8441,7523763,140516
2017-03-03 01:14:41,837471256429613056,iPhone,This is Vincent. He's suave as h*ck. Will be your copilot this evening. Claims he doesn't need to look at the directions. 12/10,12.0,10.0,Vincent,,03-03-2017,01:14,1.2,https://pbs.twimg.com/media/C59LpELWUAEUmYh.jpg,0.976255,norwegian elkhound,2017-03-03 01:14:41,13438,2462,7523763,140516
2017-03-02 01:20:01,837110210464448512,iPhone,This is Clark. He passed pupper training today. Round of appaws for Clark. 13/10,13.0,10.0,Clark,pupper,02-03-2017,01:20,1.3,https://pbs.twimg.com/media/C54DS1kXQAEU5pS.jpg,0.767696,siberian husky,2017-03-02 01:20:01,16833,2572,7523763,140516
2017-03-01 17:22:13,836989968035819520,iPhone,This is Mookie. He really enjoys shopping but not from such high altitudes. Doin him quite the concern. 12/10 someone lower him,12.0,10.0,Mookie,,01-03-2017,17:22,1.2,https://pbs.twimg.com/media/C52V7PzWcAA_pVv.jpg,0.572422,shopping cart,2017-03-01 17:22:13,13379,2471,7523763,140516
2017-02-26 23:52:43,836001077879255040,iPhone,Atlas is back and this time he's prettier than the sunset. Seems to be aware of it too. 13/10 would give modeling contract,13.0,10.0,,,26-02-2017,23:52,1.3,https://pbs.twimg.com/media/C5oSiskU0AE8sJ_.jpg,0.963558,samoyed,2017-02-26 23:52:43,20096,4619,7523763,140516
2017-02-24 17:01:22,835172783151792128,iPhone,We only rate dogs. Please don't send in any non-canines like this Floppy Tongued House Panda. Thank you... 12/10 would still pet,12.0,10.0,,,24-02-2017,17:01,1.2,https://pbs.twimg.com/media/C5chM_jWAAQmov9.jpg,0.663138,border collie,2017-02-24 17:01:22,27507,6183,7523763,140516
2017-02-23 15:25:23,834786237630337024,iPhone,This is Tobi. She is properly fetching her shot. H*ckin nifty af bandana. 13/10 would send fully armed battalion to remind her of my love,13.0,10.0,Tobi,,23-02-2017,15:25,1.3,https://pbs.twimg.com/media/C5XBp19WYAA5a_v.jpg,0.156276,border terrier,2017-02-23 15:25:23,22283,5908,7523763,140516
2017-02-22 17:41:18,834458053273591808,iPhone,"Meet Chester (bottom) &amp; Harold (top). They are different dogs not only in appearance, but in personality as well. Both 12/10 symbiotic af",12.0,10.0,Chester,,22-02-2017,17:41,1.2,https://pbs.twimg.com/media/C5SXK89XUAQg7GX.jpg,0.468619,rhodesian ridgeback,2017-02-22 17:41:18,10129,1810,7523763,140516
2017-02-22 01:14:30,834209720923721728,iPhone,This is Wilson. He's aware that he has something on his face. Waiting for you to get it for him. 12/10,12.0,10.0,Wilson,,22-02-2017,01:14,1.2,https://pbs.twimg.com/media/C5O1UAaWIAAMBMd.jpg,0.754799,golden retriever,2017-02-22 01:14:30,21702,5160,7523763,140516
2017-02-21 02:17:06,833863086058651648,iPhone,This is Bentley. Hairbrushes are his favorite thing in the h*ckin world. 12/10 impawsible to say no to,12.0,10.0,Bentley,,21-02-2017,02:17,1.2,https://pbs.twimg.com/media/C5J6DIpWQAEosSz.jpg,0.494969,kuvasz,2017-02-21 02:17:06,14125,2595,7523763,140516
2017-02-20 00:53:27,833479644947025920,iPhone,This is Poppy. She just arrived. 13/10 would snug passionately,13.0,10.0,Poppy,,20-02-2017,00:53,1.3,https://pbs.twimg.com/media/C5EdT4jWEAARv2C.jpg,0.727039,golden retriever,2017-02-20 00:53:27,15660,2233,7523763,140516
2017-02-19 01:23:00,833124694597443584,iPhone,This is Gidget. She's a spy pupper. Stealthy as h*ck. Must've slipped pup and got caught. 12/10 would forgive then pet,12.0,10.0,Gidget,pupper,19-02-2017,01:23,1.2,https://pbs.twimg.com/media/C4_ad1IUoAEspsk.jpg,0.7105229999999999,cardigan,2017-02-19 01:23:00,21276,5231,7523763,140516
2017-02-18 01:03:09,832757312314028032,iPhone,This is Willow. She's the official strawberry taste tester. Palate delicate af. Currently noting the subtle piquancy of this one. 13/10,13.0,10.0,Willow,,18-02-2017,01:03,1.3,https://pbs.twimg.com/media/C46MWnFVYAUg1RK.jpg,0.160888,cardigan,2017-02-18 01:03:09,17742,3915,7523763,140516
2017-02-17 17:01:29,832636094638288896,iPhone,This is Orion. He just got back from the dentist. Cavity free af. 12/10 would give extra pats,12.0,10.0,Orion,,17-02-2017,17:01,1.2,https://pbs.twimg.com/media/C44eG7oUMAAA4Ss.jpg,0.5250319999999999,eskimo dog,2017-02-17 17:01:29,16730,3026,7523763,140516
2017-02-17 01:13:34,832397543355072512,iPhone,This is Eevee. She wants to see how you're doing. Just checkin pup on you. She hopes you're doing okay. 12/10 extremely good girl,12.0,10.0,Eevee,,17-02-2017,01:13,1.2,https://pbs.twimg.com/media/C41FIiAW8AA7lMr.jpg,0.988916,pekinese,2017-02-17 01:13:34,12593,2402,7523763,140516
2017-02-16 17:00:25,832273440279240704,iPhone,Say hello to Smiley. He's a blind therapy doggo having a h*ckin blast high steppin around in the snow. 14/10 would follow anywhere,14.0,10.0,Smiley,doggo,16-02-2017,17:00,1.4,https://pbs.twimg.com/ext_tw_video_thumb/832273373149413377/pu/img/qOqxM0b48fEarmq6.jpg,0.134081,pembroke,2017-02-16 17:00:25,11929,2521,7523763,140516
2017-02-15 01:04:21,831670449226514432,iPhone,This is Daisy. She has a heart on her butt. 13/10 topical af,13.0,10.0,Daisy,,15-02-2017,01:04,1.3,https://pbs.twimg.com/media/C4qv3JUW8AADirb.jpg,0.6248020000000001,pembroke,2017-02-15 01:04:21,11028,1959,7523763,140516
2017-02-14 23:43:18,831650051525054464,iPhone,"I usually only share these on Friday's, but this is Blue. He's a very smoochable pooch who needs your help. 13/10

https://t.co/piiX0ke8Z6",13.0,10.0,,,14-02-2017,23:43,1.3,https://pbs.twimg.com/media/C4qdThOWAAI3WX3.jpg,0.530416,eskimo dog,2017-02-14 23:43:18,7579,2103,7523763,140516
2017-02-14 17:17:22,831552930092285952,iPhone,This is Dutch. He dressed up as his favorite emoji for Valentine's Day. I've got heart eyes for his heart eyes. 13/10,13.0,10.0,Dutch,,14-02-2017,17:17,1.3,https://pbs.twimg.com/media/C4pE-I0WQAABveu.jpg,0.257415,chihuahua,2017-02-14 17:17:22,9504,2482,7523763,140516
2017-02-14 01:35:49,831315979191906304,Web Client,I couldn't make it to the #WKCDogShow BUT I have people there on the ground relaying me the finest pupper pics possible. 13/10 for all,13.0,10.0,,pupper,14-02-2017,01:35,1.3,https://pbs.twimg.com/media/C4lst0bXAAE6MP8.jpg,0.982755,briard,2017-02-14 01:35:49,6892,1209,7523763,140516
2017-02-12 01:04:29,830583320585068544,iPhone,This is Lilly. She just parallel barked. Kindly requests a reward now. 13/10 would pet so well,13.0,10.0,Lilly,,12-02-2017,01:04,1.3,https://pbs.twimg.com/media/C4bTH6nWMAAX_bJ.jpg,0.908703,labrador retriever,2017-02-12 01:04:29,70688,18227,7523763,140516
2017-02-10 16:53:37,830097400375152640,iPhone,"Meet Samson. He's absolute fluffy perfection. Easily 13/10, but he needs your help. Click the link to find out more

https://t.co/z82hCtwhpn",13.0,10.0,Samson,,10-02-2017,16:53,1.3,https://pbs.twimg.com/media/C4UZLZLWYAA0dcs.jpg,0.442713,toy poodle,2017-02-10 16:53:37,10381,3254,7523763,140516
2017-02-10 01:15:49,829861396166877184,iPhone,This is Mia. She already knows she's a good dog. You don't have to tell her. 12/10 would probably tell her anyway,12.0,10.0,Mia,,10-02-2017,01:15,1.2,https://pbs.twimg.com/media/C4RCiIHWYAAwgJM.jpg,0.394486,border terrier,2017-02-10 01:15:49,12915,2122,7523763,140516
2017-02-09 01:27:41,829501995190984704,iPhone,This is Leo. He was a skater pup. She said see ya later pup. He wasn't good enough for her. 12/10 you're good enough for me Leo,12.0,10.0,Leo,,09-02-2017,01:27,1.2,https://pbs.twimg.com/media/C4L7p19W8AA3Fs_.jpg,0.950851,french bulldog,2017-02-09 01:27:41,33562,11508,7523763,140516
2017-02-08 22:00:52,829449946868879360,iPhone,Here's a stressed doggo. Had a long day. Many things on her mind. The hat communicates these feelings exquisitely. 11/10,11.0,10.0,,doggo,08-02-2017,22:00,1.1,https://pbs.twimg.com/media/C4LMUf8WYAkWz4I.jpg,0.315163,labrador retriever,2017-02-08 22:00:52,11059,2203,7523763,140516
2017-02-08 01:35:19,829141528400556032,iPhone,This is Malcolm. He goes from sneaky tongue slip to flirt wink city in a matter of seconds. 12/10 would hug softly,12.0,10.0,Malcolm,,08-02-2017,01:35,1.2,https://pbs.twimg.com/media/C4GzztSWAAA_qi4.jpg,0.57314,golden retriever,2017-02-08 01:35:19,25912,8036,7523763,140516
2017-02-07 17:00:28,829011960981237760,iPhone,This is Dexter. He was reunited with his mom yesterday after she was stuck in Iran during the travel Bannon. 13/10 welcome home,13.0,10.0,Dexter,,07-02-2017,17:00,1.3,https://pbs.twimg.com/media/C4E99ygWcAAQpPs.jpg,0.312221,boxer,2017-02-07 17:00:28,56046,17599,7523763,140516
2017-02-06 17:02:17,828650029636317184,iPhone,"Occasionally, we're sent fantastic stories. This is one of them. 14/10 for Grace",14.0,10.0,,,06-02-2017,17:02,1.4,https://pbs.twimg.com/media/C3_0yhCWEAETXj2.jpg,0.649209,golden retriever,2017-02-06 17:02:17,10057,1462,7523763,140516
2017-02-05 01:04:17,828046555563323392,iPhone,This is Sailer. He waits on the roof for his owners to come home. Nobody knows how he gets up there. H*ckin loyal af. 13/10,13.0,10.0,Sailer,,05-02-2017,01:04,1.3,https://pbs.twimg.com/media/C33P8PrUcAMiQQs.jpg,0.272972,patio,2017-02-05 01:04:17,12447,3107,7523763,140516
2017-02-04 22:45:42,828011680017821696,iPhone,Say hello to Brutus and Jersey. They think they're the same size. Best furiends furever. Both 11/10 would pet simultaneously,11.0,10.0,Brutus,,04-02-2017,22:45,1.1,https://pbs.twimg.com/media/C32wOLcWYAAjNqS.jpg,0.936662,american staffordshire terrier,2017-02-04 22:45:42,10979,2332,7523763,140516
2017-02-03 19:31:54,827600520311402496,iPhone,Meet Tucker. It's his birthday. He's pupset with you because you're too busy playing @GoodDogsGame to celebrate. 13/10 would put down phone,13.0,10.0,Tucker,,03-02-2017,19:31,1.3,https://pbs.twimg.com/media/C3w6RYbWQAAEQ25.jpg,0.32563800000000004,pembroke,2017-02-03 19:31:54,7842,1030,7523763,140516
2017-02-03 01:16:53,827324948884643840,iPhone,"This is Ralphie. He's being treated for an overactive funny bone, which is no joke. 12/10 would try to pet with a straight face",12.0,10.0,Ralphie,,03-02-2017,01:16,1.2,https://pbs.twimg.com/media/C3s_pYrXAAA1eqZ.jpg,0.352486,golden retriever,2017-02-03 01:16:53,16800,3330,7523763,140516
2017-02-01 17:44:55,826848821049180160,iPhone,This is Cupid. He was found in the trash. Now he's well on his way to prosthetic front legs and a long happy doggo life. 13/10 heroic af,13.0,10.0,Cupid,doggo,01-02-2017,17:44,1.3,https://pbs.twimg.com/media/C3mOnZ_XUAAjr2V.jpg,0.858764,great pyrenees,2017-02-01 17:44:55,38648,11104,7523763,140516
2017-01-31 01:27:39,826240494070030336,iPhone,We only rate dogs. Please don't send in any more non-dogs like this Wild Albanian Street Moose. Thank you... 11/10,11.0,10.0,,,31-01-2017,01:27,1.1,https://pbs.twimg.com/media/C3dlVMbXAAUd-Gh.jpg,0.903048,french bulldog,2017-01-31 01:27:39,14069,2809,7523763,140516
2017-01-30 01:21:19,825876512159186944,iPhone,This is Mo. No one will push him around in the grocery cart. He's quite pupset about it. 11/10 I volunteer,11.0,10.0,Mo,,30-01-2017,01:21,1.1,https://pbs.twimg.com/media/C3YaSnQWAAILgz0.jpg,0.995941,shopping cart,2017-01-30 01:21:19,11096,2031,7523763,140516
2017-01-29 22:15:05,825829644528148480,iPhone,This is Toby. He just found out you only pretend to throw the ball sometimes. H*ckin puppalled. 12/10 would console,12.0,10.0,Toby,,29-01-2017,22:15,1.2,https://pbs.twimg.com/media/C3XvqILXUAU2nnT.jpg,0.8534069999999999,great pyrenees,2017-01-29 22:15:05,13519,2707,7523763,140516
2017-01-29 02:44:34,825535076884762624,iPhone,Here's a very loving and accepting puppo. Appears to have read her Constitution well. 14/10 would pat head approvingly,14.0,10.0,,puppo,29-01-2017,02:44,1.4,https://pbs.twimg.com/media/C3TjvitXAAAI-QH.jpg,0.681495,rottweiler,2017-01-29 02:44:34,55235,18710,7523763,140516
2017-01-28 01:04:51,825147591692263424,iPhone,This is Sweet Pea. She hides in shoe boxes and waits for someone to pick her. Then she surpuprises them. 13/10,13.0,10.0,Sweet,,28-01-2017,01:04,1.3,https://pbs.twimg.com/media/C3ODWpfXAAAP1fb.jpg,0.354823,pekinese,2017-01-28 01:04:51,19422,4983,7523763,140516
2017-01-27 17:04:02,825026590719483904,iPhone,"Say hello to Pablo. He's one gorgeous puppo. A true 12/10. Click the link to see why Pablo requests your assistance

https://t.co/koHvVQp9bL",12.0,10.0,Pablo,puppo,27-01-2017,17:04,1.2,https://pbs.twimg.com/media/C3MVTeHWcAAGNfx.jpg,0.524454,eskimo dog,2017-01-27 17:04:02,6740,1395,7523763,140516
2017-01-27 00:24:48,824775126675836928,iPhone,This is Scooter. His lack of opposable thumbs is rendering his resistance to tickling embarrassingly moot. 12/10 would keep tickling,12.0,10.0,Scooter,,27-01-2017,00:24,1.2,https://pbs.twimg.com/media/C3Iwlr0WYAARVh4.jpg,0.610499,border terrier,2017-01-27 00:24:48,15899,3832,7523763,140516
2017-01-25 18:38:36,824325613288833024,iPhone,Retweet the h*ck out of this 13/10 pupper #BellLetsTalk,13.0,10.0,,pupper,25-01-2017,18:38,1.3,https://pbs.twimg.com/media/C3CXxaoWQAAiLuC.jpg,0.990793,pembroke,2017-01-25 18:38:36,12507,11305,7523763,140516
2017-01-24 17:04:50,823939628516474880,iPhone,This is Cash. He's officially given pup on today. 12/10 frighteningly relatable,12.0,10.0,Cash,,24-01-2017,17:04,1.2,https://pbs.twimg.com/media/C284uD8WgAEmMVn.jpg,0.23407600000000006,schipperke,2017-01-24 17:04:50,11304,2954,7523763,140516
2017-01-24 01:08:40,823699002998870016,iPhone,This is Winston. The goggles make him a superhero. Protects the entire city from criminals unless they rub his belly really well. 12/10,12.0,10.0,Winston,,24-01-2017,01:08,1.2,https://pbs.twimg.com/media/C25d3nkXEAAFBUN.jpg,0.203999,cairn,2017-01-24 01:08:40,13367,2636,7523763,140516
2017-01-23 17:20:14,823581115634085888,iPhone,This is Crawford. He's quite h*ckin good at the selfies. Nose is incredibly boopable. 11/10 would snapchat,11.0,10.0,Crawford,,23-01-2017,17:20,1.1,https://pbs.twimg.com/media/C23ypm6VQAAO31l.jpg,0.280949,dingo,2017-01-23 17:20:14,13849,2882,7523763,140516
2017-01-22 01:12:59,822975315408461824,iPhone,This is Albus. He's soaked as h*ck. Seems to have misplaced an ear as well. Still in good spirits tho. 12/10 would dry,12.0,10.0,Albus,,22-01-2017,01:12,1.2,https://pbs.twimg.com/media/C2vLrpvWIAA3LM3.jpg,0.331098,bathtub,2017-01-22 01:12:59,18372,3751,7523763,140516
2017-01-21 01:02:48,822610361945911296,iPhone,Please stop sending in non-canines like this Very Pettable Dozing Bath Tortoise. We only rate dogs. Only send dogs... 12/10,12.0,10.0,,,21-01-2017,01:02,1.2,https://pbs.twimg.com/media/C2p_wQyXEAELtvS.jpg,0.6644869999999999,cocker spaniel,2017-01-21 01:02:48,15698,3238,7523763,140516
2017-01-20 00:50:15,822244816520155136,iPhone,We only rate dogs. Please don't send pics of men capturing low level clouds. Thank you... 11/10,11.0,10.0,,,20-01-2017,00:50,1.1,https://pbs.twimg.com/media/C2kzTGxWEAEOpPL.jpg,0.585441,samoyed,2017-01-20 00:50:15,37251,10743,7523763,140516
2017-01-19 01:04:45,821886076407029760,iPhone,This is Jimison. He was just called a good boy. 13/10,13.0,10.0,Jimison,,19-01-2017,01:04,1.3,https://pbs.twimg.com/media/C2ftAxnWIAEUdAR.jpg,0.26623800000000003,golden retriever,2017-01-19 01:04:45,12091,2557,7523763,140516
2017-01-18 17:07:18,821765923262631936,iPhone,This is Duchess. She uses dark doggo forces to levitate her toys. 13/10 magical af,13.0,10.0,Duchess,doggo,18-01-2017,17:07,1.3,https://pbs.twimg.com/media/C2d_vnHWEAE9phX.jpg,0.980071,golden retriever,2017-01-18 17:07:18,8960,1819,7523763,140516
2017-01-17 00:18:04,821149554670182400,iPhone,This is Luca. He got caught howling. H*ckin embarrassed. 12/10,12.0,10.0,Luca,,17-01-2017,00:18,1.2,https://pbs.twimg.com/ext_tw_video_thumb/821149477142556673/pu/img/88_DV098c60pC5AA.jpg,0.515933,german shepherd,2017-01-17 00:18:04,9279,2198,7523763,140516
2017-01-16 17:20:45,821044531881721856,iPhone,This is Flash. He went way too hard celebrating Martin Luther King Day last night. 12/10 now he's having a dream in his honor,12.0,10.0,Flash,,16-01-2017,17:20,1.2,https://pbs.twimg.com/media/C2Tvo20XcAAhNL9.jpg,0.14802,old english sheepdog,2017-01-16 17:20:45,13490,2502,7523763,140516
2017-01-14 17:00:24,820314633777061888,iPhone,"We are proud to support @LoveYourMelon on their mission to put a hat on every kid battling cancer. They are 14/10

https://t.co/XQlmPTLHPl",14.0,10.0,,,14-01-2017,17:00,1.4,https://pbs.twimg.com/media/C2JXyARUAAE4gbL.jpg,0.940724,gordon setter,2017-01-14 17:00:24,3549,620,7523763,140516
2017-01-13 17:00:21,819952236453363712,iPhone,"This is Oliver. He has dreams of being a service puppo so he can help his owner. 13/10 selfless af

make it happen:
https://t.co/f5WMsx0a9K",13.0,10.0,Oliver,puppo,13-01-2017,17:00,1.3,https://pbs.twimg.com/media/C2EONHNWQAUWxkP.jpg,0.925505,american staffordshire terrier,2017-01-13 17:00:21,5666,1297,7523763,140516
2017-01-13 15:08:56,819924195358416896,iPhone,Here we have a doggo who has messed up. He was hoping you wouldn't notice. 11/10 someone help him,11.0,10.0,,doggo,13-01-2017,15:08,1.1,https://pbs.twimg.com/ext_tw_video_thumb/819924138965999617/pu/img/6OIToyT9eLESHXLU.jpg,0.100896,bathtub,2017-01-13 15:08:56,13707,5290,7523763,140516
2017-01-12 16:54:26,819588359383371776,iPhone,This is Jazzy. She just found out that sandwich wasn't for her. Shocked and puppalled. 13/10 deep breaths Jazzy,13.0,10.0,Jazzy,,12-01-2017,16:54,1.3,https://pbs.twimg.com/media/C1_DQn3UoAIoJy7.jpg,0.5479350000000001,cardigan,2017-01-12 16:54:26,10194,2151,7523763,140516
2017-01-11 17:01:16,819227688460238848,iPhone,This is Finn. He's wondering if you come here often. Fr*ckin flirtatious af. 12/10 would give number to,12.0,10.0,Finn,,11-01-2017,17:01,1.2,https://pbs.twimg.com/media/C157Oq3WQAEOyHm.jpg,0.4824520000000001,border terrier,2017-01-11 17:01:16,24611,7320,7523763,140516
2017-01-11 02:15:36,819004803107983360,iPhone,This is Bo. He was a very good First Doggo. 14/10 would be an absolute honor to pet,14.0,10.0,Bo,doggo,11-01-2017,02:15,1.4,https://pbs.twimg.com/media/C12whDoVEAALRxa.jpg,0.351308,standard poodle,2017-01-11 02:15:36,92117,40140,7523763,140516
2017-01-10 01:15:10,818627210458333184,iPhone,Meet Wafer. He represents every fiber of my being. 13/10 very good dog,13.0,10.0,Wafer,,10-01-2017,01:15,1.3,https://pbs.twimg.com/media/C1xZGkzWIAA8vh4.jpg,0.384188,labrador retriever,2017-01-10 01:15:10,23651,8146,7523763,140516
2017-01-09 19:14:36,818536468981415936,iPhone,This is Tom. He's a silly dog. Known for his unconventional swing style. One h*ck of a sneaky tongue slip too. 11/10 would push,11.0,10.0,Tom,,09-01-2017,19:14,1.1,https://pbs.twimg.com/media/C1wGkYoVQAAuC_O.jpg,0.999403,swing,2017-01-09 19:14:36,11637,2711,7523763,140516
2017-01-09 00:53:55,818259473185828864,iPhone,This is Florence. He saw the same snap you sent him on your story. Pretty pupset with you. 12/10,12.0,10.0,Florence,,09-01-2017,00:53,1.2,https://pbs.twimg.com/media/C1sKo_QUkAALtkw.jpg,0.367368,miniature schnauzer,2017-01-09 00:53:55,11769,2505,7523763,140516
2017-01-06 17:00:38,817415592588222464,iPhone,"Meet Strudel. He's rather h*ckin pupset that your clothes clash. 11/10 click the link to see how u can help Strudel

https://t.co/3uxgLz8d0l",11.0,10.0,Strudel,,06-01-2017,17:00,1.1,https://pbs.twimg.com/media/C1gLJVpWgAApI3r.jpg,0.806163,doberman,2017-01-06 17:00:38,5988,1056,7523763,140516
2017-01-06 00:49:53,817171292965273600,iPhone,This is Tebow. He kindly requests that you put down the coffee and play with him. 13/10 such a good boy,13.0,10.0,Tebow,,06-01-2017,00:49,1.3,https://pbs.twimg.com/media/C1cs8uAWgAEwbXc.jpg,0.295483,golden retriever,2017-01-06 00:49:53,9314,2201,7523763,140516
2017-01-05 21:29:55,817120970343411712,iPhone,Name a more iconic quartet... I'll wait. 13/10 for all,13.0,10.0,,,05-01-2017,21:29,1.3,https://pbs.twimg.com/media/C1b_LSYUsAAJ494.jpg,0.568809,saluki,2017-01-05 21:29:55,12991,2874,7523763,140516
2017-01-05 17:13:55,817056546584727552,iPhone,This is Chloe. She fell asleep at the wheel. Absolute menace on the roadways. Sneaky tongue slip tho. 11/10,11.0,10.0,Chloe,,05-01-2017,17:13,1.1,https://pbs.twimg.com/media/C1bEl4zVIAASj7_.jpg,0.8644149999999999,kelpie,2017-01-05 17:13:55,9156,1813,7523763,140516
2017-01-05 01:20:46,816816676327063552,iPhone,This is Timber. He misses Christmas. Specifically the presents part. 12/10 cheer pup Timber,12.0,10.0,Timber,,05-01-2017,01:20,1.2,https://pbs.twimg.com/media/C1XqbhXXUAElpfI.jpg,0.668164,malamute,2017-01-05 01:20:46,10678,2231,7523763,140516
2017-01-03 17:33:39,816336735214911488,iPhone,This is Dudley. He found a flower and now he's a queen. 11/10 would be an honor to pet,11.0,10.0,Dudley,,03-01-2017,17:33,1.1,https://pbs.twimg.com/media/C1Q17WdWEAAjKFO.jpg,0.91933,labrador retriever,2017-01-03 17:33:39,9180,2145,7523763,140516
2017-01-03 01:20:49,816091915477250048,iPhone,This is Comet. He's a Wild Estonian Poofer. Surprised they caught him. 12/10 would pet well,12.0,10.0,Comet,,03-01-2017,01:20,1.2,https://pbs.twimg.com/media/C1NXQ6NXUAEAxIQ.jpg,0.967345,pomeranian,2017-01-03 01:20:49,9534,2364,7523763,140516
2017-01-02 17:00:46,815966073409433600,iPhone,Here's a pupper with squeaky hiccups. Please enjoy. 13/10,13.0,10.0,,pupper,02-01-2017,17:00,1.3,https://pbs.twimg.com/ext_tw_video_thumb/815965888126062592/pu/img/JleSw4wRhgKDWQj5.jpg,0.506312,tibetan mastiff,2017-01-02 17:00:46,23986,9311,7523763,140516
2017-01-02 01:48:06,815736392542261248,iPhone,This is Akumi. It's his birthday. He received many lickable gifts. 11/10 happy h*ckin birthday,11.0,10.0,Akumi,,02-01-2017,01:48,1.1,https://pbs.twimg.com/media/C1IT6rVXUAIvwYT.jpg,0.5489069999999999,border collie,2017-01-02 01:48:06,10517,2493,7523763,140516
2017-01-01 02:53:20,815390420867969024,iPhone,Happy New Year from the squad! 13/10 for all,13.0,10.0,,,01-01-2017,02:53,1.3,https://pbs.twimg.com/media/C1DZQiTXgAUqgRI.jpg,0.279846,restaurant,2017-01-01 02:53:20,11071,4177,7523763,140516
2016-12-31 00:08:17,814986499976527872,iPhone,This is Cooper. Someone attacked him with a sharpie. Poor pupper. 11/10 nifty tongue slip tho,11.0,10.0,Cooper,pupper,31-12-2016,00:08,1.1,https://pbs.twimg.com/media/C09p5dJWIAE5qKL.jpg,0.999828,dalmatian,2016-12-31 00:08:17,8155,1420,7523763,140516
2016-12-30 01:05:33,814638523311648768,iPhone,This is Olivia. She's a passionate advocate of candid selfies. 12/10 would boop shnoop,12.0,10.0,Olivia,,30-12-2016,01:05,1.2,https://pbs.twimg.com/media/C04taUjWIAA6Mo4.jpg,0.650814,golden retriever,2016-12-30 01:05:33,12046,2969,7523763,140516
2016-12-29 17:54:58,814530161257443328,iPhone,This is Alf. Someone just rubbed a balloon on his head. He's only a little pupset about it. 12/10 would pet well,12.0,10.0,Alf,,29-12-2016,17:54,1.2,https://pbs.twimg.com/media/C03K2-VWIAAK1iV.jpg,0.626913,miniature poodle,2016-12-29 17:54:58,9267,2034,7523763,140516
2016-12-28 00:52:25,813910438903693312,iPhone,This is Chubbs. He dug a hole and now he's stuck in it. Dang h*ckin doggo. 11/10 would assist,11.0,10.0,Chubbs,doggo,28-12-2016,00:52,1.1,https://pbs.twimg.com/media/C0uXObSXUAAIzmV.jpg,0.6993550000000001,siberian husky,2016-12-28 00:52:25,9937,2065,7523763,140516
2016-12-27 18:24:12,813812741911748608,iPhone,"Meet Gary, Carrie Fisher's dog. Idk what I can say about Gary that reflects the inspirational awesomeness that was Carrie Fisher. 14/10 RIP",14.0,10.0,Gary,,27-12-2016,18:24,1.4,https://pbs.twimg.com/media/C0s-XtzWgAAp1W-.jpg,0.709146,french bulldog,2016-12-27 18:24:12,38866,15369,7523763,140516
2016-12-27 17:36:16,813800681631023104,iPhone,This is Sky. She's learning how to roll her R's. 12/10 cultured af,12.0,10.0,Sky,,27-12-2016,17:36,1.2,https://pbs.twimg.com/media/C0szZh_XUAAm9je.jpg,0.501159,malamute,2016-12-27 17:36:16,8924,1925,7523763,140516
2016-12-26 03:00:30,813217897535406080,iPhone,Here is Atlas. He went all out this year. 13/10 downright magical af,13.0,10.0,Atlas,,26-12-2016,03:00,1.3,https://pbs.twimg.com/media/C0khWkVXEAI389B.jpg,0.905972,samoyed,2016-12-26 03:00:30,19980,8010,7523763,140516
2016-12-26 02:00:11,813202720496779264,iPhone,Here's a doggo who has concluded that Christmas is entirely too bright. Requests you tone it down a notch. 11/10,11.0,10.0,,doggo,26-12-2016,02:00,1.1,https://pbs.twimg.com/media/C0kTjqIXgAAqpRi.jpg,0.701852,cocker spaniel,2016-12-26 02:00:11,9815,1970,7523763,140516
2016-12-26 01:00:05,813187593374461952,iPhone,We only rate dogs. Please don't send in other things like this very good Christmas tree. Thank you... 13/10,13.0,10.0,,,26-12-2016,01:00,1.3,https://pbs.twimg.com/media/C0kFzOQUoAAt6yb.jpg,0.888181,golden retriever,2016-12-26 01:00:05,21215,4796,7523763,140516
2016-12-25 23:00:08,813157409116065792,iPhone,This is Layla. It is her first Christmas. She got to be one of the presents. 12/10 I wish my presents would bark,12.0,10.0,Layla,,25-12-2016,23:00,1.2,https://pbs.twimg.com/media/C0jqVVOXUAAGJ0G.jpg,0.8439110000000001,siamese cat,2016-12-25 23:00:08,8294,2435,7523763,140516
2016-12-25 21:00:18,813127251579564032,iPhone,Here's an anonymous doggo that appears to be very done with Christmas. 11/10 cheer up pup,11.0,10.0,,doggo,25-12-2016,21:00,1.1,https://pbs.twimg.com/media/C0jO6aBWEAAM28r.jpg,0.432416,norwegian elkhound,2016-12-25 21:00:18,12685,3437,7523763,140516
2016-12-25 20:00:07,813112105746448384,iPhone,Meet Toby. He's pupset because his hat isn't big enough. Christmas is ruined. 12/10 it'll be ok Toby,12.0,10.0,Toby,,25-12-2016,20:00,1.2,https://pbs.twimg.com/media/C0jBJZVWQAA2_-X.jpg,0.287369,dingo,2016-12-25 20:00:07,11043,3024,7523763,140516
2016-12-25 19:00:02,813096984823349248,iPhone,This is Rocky. He got triple-doggo-dared. Stuck af. 11/10 someone help him,11.0,10.0,Rocky,doggo,25-12-2016,19:00,1.1,https://pbs.twimg.com/media/C0izZULWgAAKD-F.jpg,0.128056,great dane,2016-12-25 19:00:02,11266,3959,7523763,140516
2016-12-25 16:00:16,813051746834595840,iPhone,This is Bauer. He had nothing to do with the cookies that disappeared. 13/10 very good boy,13.0,10.0,Bauer,,25-12-2016,16:00,1.3,https://pbs.twimg.com/media/C0iKPZIXUAAbDYV.jpg,0.914804,golden retriever,2016-12-25 16:00:16,22442,8051,7523763,140516
2016-12-24 17:18:34,812709060537683968,iPhone,This is Brandi and Harley. They are practicing their caroling for later. Both 12/10 festive af,12.0,10.0,Brandi,,24-12-2016,17:18,1.2,https://pbs.twimg.com/media/C0dSk98WEAALyya.jpg,0.326873,irish setter,2016-12-24 17:18:34,7094,1569,7523763,140516
2016-12-24 03:40:19,812503143955202048,iPhone,"I'm happy to inform you all that Jake is in excellent hands. 13/10 for him and his new family 
https://t.co/LRCTJpnCnS",13.0,10.0,,,24-12-2016,03:40,1.3,https://pbs.twimg.com/media/C0aXTLqXEAADxBi.jpg,0.546856,loupe,2016-12-24 03:40:19,6499,1344,7523763,140516
2016-12-24 01:16:12,812466873996607488,iPhone,This is Mary. She's desperately trying to recreate her Coachella experience.   12/10 downright h*ckin adorable,12.0,10.0,Mary,,24-12-2016,01:16,1.2,https://pbs.twimg.com/media/C0Z2T_GWgAAxbL9.jpg,0.0998035,bath towel,2016-12-24 01:16:12,8557,2116,7523763,140516
2016-12-21 17:39:46,811627233043480576,iPhone,This is Augie. He's a savage. Doesn't give a h*ck about your garden. Still 10/10 would forgive then pet,10.0,10.0,Augie,,21-12-2016,17:39,1.0,https://pbs.twimg.com/media/C0N6opSXAAAkCtN.jpg,0.39628,beagle,2016-12-21 17:39:46,13692,3436,7523763,140516
2016-12-21 01:44:13,811386762094317568,iPhone,This is Craig. That's actually a normal sized fence he's stuck on. H*ckin massive pupper. 11/10 someone help him,11.0,10.0,Craig,pupper,21-12-2016,01:44,1.1,https://pbs.twimg.com/media/C0Kf9PtWQAEW4sE.jpg,0.804177,pembroke,2016-12-21 01:44:13,22388,7029,7523763,140516
2016-12-19 23:06:23,810984652412424192,iPhone,"Meet Sam. She smiles 24/7 &amp; secretly aspires to be a reindeer. 
Keep Sam smiling by clicking and sharing this link:
https://t.co/98tB8y7y7t",24.0,10.0,Sam,,19-12-2016,23:06,2.4,https://pbs.twimg.com/media/C0EyPZbXAAAceSc.jpg,0.8713420000000001,golden retriever,2016-12-19 23:06:23,5703,1577,7523763,140516
2016-12-19 17:14:23,810896069567610880,iPhone,"This is Hunter. He just found out he needs braces. Requesting an orthodogtist stat. 11/10 you're fine Hunter, everything's fine",11.0,10.0,Hunter,,19-12-2016,17:14,1.1,https://pbs.twimg.com/media/C0DhpcrUAAAnx88.jpg,0.8208040000000001,flat-coated retriever,2016-12-19 17:14:23,9694,1966,7523763,140516
2016-12-18 00:43:57,810284430598270976,iPhone,This is Phil. He's a father. A very good father too. 13/10 everybody loves Phil,13.0,10.0,Phil,,18-12-2016,00:43,1.3,https://pbs.twimg.com/media/Cz61ZD4W8AAcJEU.jpg,0.620768,malamute,2016-12-18 00:43:57,37947,12536,7523763,140516
2016-12-17 00:38:52,809920764300447744,iPhone,"Please only send in dogs. We only rate dogs, not seemingly heartbroken ewoks. Thank you... still 10/10 would console",10.0,10.0,,,17-12-2016,00:38,1.0,https://pbs.twimg.com/media/Cz1qo05XUAQ4qXp.jpg,0.397163,norwich terrier,2016-12-17 00:38:52,16599,4289,7523763,140516
2016-12-15 17:23:04,809448704142938112,iPhone,"I call this one ""A Blep by the Sea"" 12/10",12.0,10.0,,,15-12-2016,17:23,1.2,https://pbs.twimg.com/media/Czu9RiwVEAA_Okk.jpg,0.375415,greater swiss mountain dog,2016-12-15 17:23:04,7424,1614,7523763,140516
2016-12-14 17:16:53,809084759137812480,iPhone,"This is Wallace. You said you brushed your teeth but he checked your toothbrush and it was bone dry. 11/10 not pupset, just disappointed",11.0,10.0,Wallace,,14-12-2016,17:16,1.1,https://pbs.twimg.com/media/CzpyM41UoAE1b2w.jpg,0.911412,vizsla,2016-12-14 17:16:53,14166,3854,7523763,140516
2016-12-14 00:57:20,808838249661788160,iPhone,This is Ito. He'll be your uber driver tonight. Currently adjusting the mirrors. 13/10 incredibly h*ckin responsible,13.0,10.0,Ito,,14-12-2016,00:57,1.3,https://pbs.twimg.com/media/CzmSFlKUAAAQOjP.jpg,0.36953,rottweiler,2016-12-14 00:57:20,10831,3342,7523763,140516
2016-12-11 17:31:39,808001312164028416,iPhone,This is Cooper. He likes to stick his tongue out at you and then laugh about it. 12/10 quite the jokester,12.0,10.0,Cooper,,11-12-2016,17:31,1.2,https://pbs.twimg.com/media/CzaY5UdUoAAC91S.jpg,0.730959,labrador retriever,2016-12-11 17:31:39,13476,3889,7523763,140516
2016-12-10 16:22:02,807621403335917568,iPhone,This is Ollie Vue. He was a 3 legged pupper on a mission to overcome everything. This is very hard to write. 14/10 we will miss you Ollie,14.0,10.0,Ollie,pupper,10-12-2016,16:22,1.4,https://pbs.twimg.com/media/CzU_YVGUUAA3Xsd.jpg,0.873233,golden retriever,2016-12-10 16:22:02,15621,4049,7523763,140516
2016-12-09 06:17:20,807106840509214720,iPhone,This is Stephan. He just wants to help. 13/10 such a good boy,13.0,10.0,Stephan,,09-12-2016,06:17,1.3,https://pbs.twimg.com/ext_tw_video_thumb/807106774843039744/pu/img/8XZg1xW35Xp2J6JW.jpg,0.50537,chihuahua,2016-12-09 06:17:20,127321,61115,7523763,140516
2016-12-08 23:53:08,807010152071229440,iPhone,This is Lennon. He's a Boopershnoop Pupperdoop. Quite rare. Exceptionally pettable. 12/10 would definitely boop that shnoop,12.0,10.0,Lennon,,08-12-2016,23:53,1.2,https://pbs.twimg.com/media/CzMTcZoXUAEKqEt.jpg,0.610807,golden retriever,2016-12-08 23:53:08,13978,4211,7523763,140516
2016-12-07 16:53:43,806542213899489280,iPhone,This is Waffles. He's concerned that the dandruff shampoo he just bought is faulty. 11/10 tragic af,11.0,10.0,Waffles,,07-12-2016,16:53,1.1,https://pbs.twimg.com/media/CzFp3FNW8AAfvV8.jpg,0.938617,vizsla,2016-12-07 16:53:43,10955,2605,7523763,140516
2016-12-06 19:29:28,806219024703037440,iPhone,We only rate dogs. Please stop sending in non-canines like this Freudian Poof Lion. This is incredibly frustrating... 11/10,11.0,10.0,,,06-12-2016,19:29,1.1,https://pbs.twimg.com/media/CzBD7MWVIAA5ptx.jpg,0.835102,chow,2016-12-06 19:29:28,6883,1315,7523763,140516
2016-12-06 00:32:26,805932879469572096,iPhone,This is Major. He put on a tie for his first real walk. Only a little crooked. Can also drool upwards. H*ckin talented. 12/10,12.0,10.0,Major,,06-12-2016,00:32,1.2,https://pbs.twimg.com/media/Cy8_qt0UUAAHuuN.jpg,0.657967,norwegian elkhound,2016-12-06 00:32:26,8868,2104,7523763,140516
2016-12-05 17:31:15,805826884734976000,iPhone,This is Duke. He is not a fan of the pupporazzi. 12/10,12.0,10.0,Duke,,05-12-2016,17:31,1.2,https://pbs.twimg.com/ext_tw_video_thumb/805826823359631360/pu/img/yr_fF0TZCR-B70p2.jpg,0.248926,siberian husky,2016-12-05 17:31:15,7057,2014,7523763,140516
2016-12-04 21:14:20,805520635690676224,iPhone,This is Zeke the Wonder Dog. He never let that poor man keep his frisbees. One of the Spartans all time greatest receivers. 13/10 RIP Zeke,13.0,10.0,Zeke,,04-12-2016,21:14,1.3,https://pbs.twimg.com/media/Cy3IvdZXgAUoEaj.jpg,0.643147,malinois,2016-12-04 21:14:20,6144,1814,7523763,140516
2016-12-04 19:02:24,805487436403003392,iPhone,"Meet Sansa and Gary. They run along the fence together everyday, so the owners installed a window for them. Both 12/10 h*ckin romantic af",12.0,10.0,Sansa,,04-12-2016,19:02,1.2,https://pbs.twimg.com/media/Cy2qiTxXcAAtQBH.jpg,0.58783,shield,2016-12-04 19:02:24,9400,2790,7523763,140516
2016-12-02 17:27:25,804738756058218496,iPhone,This is Django. He accidentally opened the front facing camera. Did him quite the frighten. 12/10,12.0,10.0,Django,,02-12-2016,17:27,1.2,https://pbs.twimg.com/media/CysBn-lWIAAoRx1.jpg,0.91579,tibetan mastiff,2016-12-02 17:27:25,14727,4237,7523763,140516
2016-11-30 01:31:12,803773340896923648,iPhone,This is Diogi. He fell in the pool as soon as he was brought home. Clumsy puppo. 12/10 would pet until dry,12.0,10.0,Diogi,puppo,30-11-2016,01:31,1.2,https://pbs.twimg.com/media/CyeTku-XcAALkBd.jpg,0.817066,miniature pinscher,2016-11-30 01:31:12,10769,3048,7523763,140516
2016-11-29 16:33:36,803638050916102144,iPhone,Pupper hath acquire enemy. 13/10,13.0,10.0,,pupper,29-11-2016,16:33,1.3,https://pbs.twimg.com/ext_tw_video_thumb/803638023904559104/pu/img/vxm0Htm5iIV7EOAQ.jpg,0.372776,labrador retriever,2016-11-29 16:33:36,11786,4549,7523763,140516
2016-11-28 16:37:19,803276597545603072,iPhone,This is Winston. His selfie game is legendary. Will steal your girl with a single snap. 11/10 handsome as h*ck,11.0,10.0,Winston,,28-11-2016,16:37,1.1,https://pbs.twimg.com/media/CyXPzXRWgAAvd1j.jpg,0.457086,pembroke,2016-11-28 16:37:19,10758,2719,7523763,140516
2016-11-27 19:09:28,802952499103731712,iPhone,This is Marley. She's having a ruff day. Pretty pupset. 12/10 would assist,12.0,10.0,Marley,,27-11-2016,19:09,1.2,https://pbs.twimg.com/media/CySpCSHXcAAN-qC.jpg,0.944032,chow,2016-11-27 19:09:28,9693,2211,7523763,140516
2016-11-26 18:00:13,802572683846291456,iPhone,This is Winnie. She's h*ckin ferocious. Dandelion doesn't even see her coming. 12/10 would pet with caution,12.0,10.0,Winnie,,26-11-2016,18:00,1.2,https://pbs.twimg.com/media/CyNPmJgXcAECPuB.jpg,0.610171,golden retriever,2016-11-26 18:00:13,9586,2752,7523763,140516
2016-11-25 19:55:35,802239329049477120,iPhone,This is Loki. He'll do your taxes for you. Can also make room in your budget for all the things you bought today. 12/10 what a puppo,12.0,10.0,Loki,puppo,25-11-2016,19:55,1.2,https://pbs.twimg.com/media/CyIgaTEVEAA-9zS.jpg,0.482498,eskimo dog,2016-11-25 19:55:35,9745,2867,7523763,140516
2016-11-25 01:18:59,801958328846974976,iPhone,This is Ronnie. He hopes you're having a great day. Nifty tongue slip. 12/10 would pat head approvingly,12.0,10.0,Ronnie,,25-11-2016,01:18,1.2,https://pbs.twimg.com/media/CyEg2AXUsAA1Qpf.jpg,0.327887,staffordshire bullterrier,2016-11-25 01:18:59,8281,1883,7523763,140516
2016-11-23 21:29:33,801538201127157760,iPhone,This is Wallace. He'll be your chau-fur this evening. 12/10 eyes on the road Wallace,12.0,10.0,Wallace,,23-11-2016,21:29,1.2,https://pbs.twimg.com/media/Cx-itFWWIAAZu7l.jpg,0.550506,pembroke,2016-11-23 21:29:33,8806,2263,7523763,140516
2016-11-23 04:45:12,801285448605831168,iPhone,oh h*ck 10/10,10.0,10.0,,,23-11-2016,04:45,1.0,https://pbs.twimg.com/media/Cx683NPUAAAjyU4.jpg,0.789376,minivan,2016-11-23 04:45:12,6497,919,7523763,140516
2016-11-22 20:58:07,801167903437357056,iPhone,This is Milo. I would do terrible things for Milo. 13/10,13.0,10.0,Milo,,22-11-2016,20:58,1.3,https://pbs.twimg.com/media/Cx5R8wPVEAALa9r.jpg,0.74022,cocker spaniel,2016-11-22 20:58:07,26318,6548,7523763,140516
2016-11-22 17:28:25,801115127852503040,iPhone,This is Bones. He's being haunted by another doggo of roughly the same size. 12/10 deep breaths pupper everything's fine,12.0,10.0,Bones,"pupper, doggo",22-11-2016,17:28,1.2,https://pbs.twimg.com/media/Cx4h7zHUsAAqaJd.jpg,0.823356,dalmatian,2016-11-22 17:28:25,8679,2302,7523763,140516
2016-11-21 17:23:47,800751577355128832,iPhone,Say hello to Mauve and Murphy. They're rather h*ckin filthy. Preferred nap over bath. Both 12/10,12.0,10.0,Mauve,,21-11-2016,17:23,1.2,https://pbs.twimg.com/media/CxzXOyBW8AEu_Oi.jpg,0.771984,cocker spaniel,2016-11-21 17:23:47,11269,3054,7523763,140516
2016-11-21 01:37:04,800513324630806528,iPhone,This is Chef. Chef loves everyone and wants everyone to love each other. 11/10,11.0,10.0,Chef,,21-11-2016,01:37,1.1,https://pbs.twimg.com/media/Cxv-nkJUoAAhzMt.jpg,0.8289040000000001,pembroke,2016-11-21 01:37:04,14109,3312,7523763,140516
2016-11-20 00:59:15,800141422401830912,iPhone,This is Peaches. She's the ultimate selfie sidekick. Super sneaky tongue slip appreciated. 13/10,13.0,10.0,Peaches,,20-11-2016,00:59,1.3,https://pbs.twimg.com/media/CxqsX-8XUAAEvjD.jpg,0.938048,golden retriever,2016-11-20 00:59:15,16434,2827,7523763,140516
2016-11-18 01:24:14,799422933579902976,iPhone,This is Longfellow (prolly sophisticated). He's a North Appalachian Oatzenjammer. Concerned about wrinkled feets. 12/10 would hug softly,12.0,10.0,Longfellow,,18-11-2016,01:24,1.2,https://pbs.twimg.com/media/Cxge6AdUQAAvXLB.jpg,0.58363,miniature pinscher,2016-11-18 01:24:14,8646,2111,7523763,140516
2016-11-17 01:35:54,799063482566066176,iPhone,This is Mister. He only wears the most fashionable af headwear. 11/10 h*ckin stylish,11.0,10.0,Mister,,17-11-2016,01:35,1.1,https://pbs.twimg.com/media/CxbX_n2WIAAHaLS.jpg,0.334436,norfolk terrier,2016-11-17 01:35:54,8693,2714,7523763,140516
2016-11-16 17:01:16,798933969379225600,iPhone,This is Iroh. He's in a predicament. 12/10 someone help him,12.0,10.0,Iroh,,16-11-2016,17:01,1.2,https://pbs.twimg.com/media/CxZiLcLXUAApMVy.jpg,0.703224,siberian husky,2016-11-16 17:01:16,14129,4937,7523763,140516
2016-11-16 16:28:21,798925684722855936,iPhone,This is Shadow. He's a firm believer that they're all good dogs. H*ckin passionate about it too. 11/10 I stand with Shadow,11.0,10.0,Shadow,,16-11-2016,16:28,1.1,https://pbs.twimg.com/media/CxZaqh_WQAA7lY3.jpg,0.539463,west highland white terrier,2016-11-16 16:28:21,7991,1584,7523763,140516
2016-11-14 17:03:50,798209839306514432,iPhone,This is Cooper. His bow tie was too heavy for the front so he moved it to the side. Balanced af now. 13/10,13.0,10.0,Cooper,,14-11-2016,17:03,1.3,https://pbs.twimg.com/media/CxPPnCYWIAAo_ao.jpg,0.524583,pekinese,2016-11-14 17:03:50,11152,2821,7523763,140516
2016-11-12 21:02:38,797545162159308800,iPhone,This is Cassie. She steals things. Guilt increases slightly each time. 12/10 would forgive almost immediately,12.0,10.0,Cassie,,12-11-2016,21:02,1.2,https://pbs.twimg.com/media/CxFzFAAUAAA5C9z.jpg,0.954089,pembroke,2016-11-12 21:02:38,15577,5356,7523763,140516
2016-11-12 00:36:46,797236660651966464,iPhone,This is Pancake. She loves Batman and winks like a h*ckin champ. 12/10 real crowd pleaser,12.0,10.0,Pancake,,12-11-2016,00:36,1.2,https://pbs.twimg.com/media/CxBafisWQAAtJ1X.jpg,0.767005,collie,2016-11-12 00:36:46,21462,7309,7523763,140516
2016-11-10 17:02:03,796759840936919040,iPhone,Say hello to Romeo. He was just told that it's too cold for the pool. H*ckin nonsense. 11/10 would help fill up,11.0,10.0,Romeo,,10-11-2016,17:02,1.1,https://pbs.twimg.com/media/Cw6o1JQXcAAtP78.jpg,0.463996,american staffordshire terrier,2016-11-10 17:02:03,12755,3367,7523763,140516
2016-11-09 22:49:15,796484825502875648,iPhone,Here's a sleepy doggo that requested some assistance. 12/10 would carry everywhere,12.0,10.0,,doggo,09-11-2016,22:49,1.2,https://pbs.twimg.com/media/Cw2uty8VQAAB0pL.jpg,0.116924,cocker spaniel,2016-11-09 22:49:15,8145,1943,7523763,140516
2016-11-09 16:22:22,796387464403357696,iPhone,This is Snicku. He's having trouble reading because he's a dog. Glasses only helped a little. Nap preferred. 12/10 would snug well,12.0,10.0,Snicku,,09-11-2016,16:22,1.2,https://pbs.twimg.com/media/Cw1WKu1UQAAvWsu.jpg,0.461164,pekinese,2016-11-09 16:22:22,11824,4592,7523763,140516
2016-11-07 03:14:10,795464331001561088,iPhone,Elder doggo does a splash. Both 13/10 incredible stuff,13.0,10.0,,doggo,07-11-2016,03:14,1.3,https://pbs.twimg.com/ext_tw_video_thumb/795464066940764160/pu/img/jPkMMQXdydb7CqFX.jpg,0.193082,golden retriever,2016-11-07 03:14:10,53507,26260,7523763,140516
2016-11-06 01:33:58,795076730285391872,iPhone,This is Bailey. She loves going down slides but is very bad at it. Still 11/10,11.0,10.0,Bailey,,06-11-2016,01:33,1.1,https://pbs.twimg.com/media/CwiuEJmW8AAZnit.jpg,0.676439,gas pump,2016-11-06 01:33:58,17434,5985,7523763,140516
2016-11-04 00:15:59,794332329137291264,iPhone,This is Nimbus (like the cloud). He just bought this fancy af duck raincoat. Only protects one ear tho. 12/10 so h*ckin floofy,12.0,10.0,Nimbus,,04-11-2016,00:15,1.2,https://pbs.twimg.com/media/CwYJBiHXgAQlvrh.jpg,0.988307,samoyed,2016-11-04 00:15:59,10291,2917,7523763,140516
2016-11-02 23:45:19,793962221541933056,iPhone,This is Maximus. His face is stuck like that. Tragic really. Great tongue tho. 12/10 would pet firmly,12.0,10.0,Maximus,,02-11-2016,23:45,1.2,https://pbs.twimg.com/media/CwS4aqZXUAAe3IO.jpg,0.8616510000000001,labrador retriever,2016-11-02 23:45:19,18078,5396,7523763,140516
2016-11-02 16:00:06,793845145112371200,iPhone,This is Clark. He was just caught wearing pants. 13/10 game-changing af,13.0,10.0,Clark,,02-11-2016,16:00,1.3,https://pbs.twimg.com/media/CwRN8H6WgAASe4X.jpg,0.7652770000000001,old english sheepdog,2016-11-02 16:00:06,9884,2065,7523763,140516
2016-11-01 23:53:02,793601777308463104,iPhone,This is Dobby. I can't stop looking at her feet. 12/10 would absolutely snug,12.0,10.0,Dobby,,01-11-2016,23:53,1.2,https://pbs.twimg.com/media/CwNwmxvXEAEJ54Z.jpg,0.538981,miniature pinscher,2016-11-01 23:53:02,8564,1804,7523763,140516
2016-11-01 03:00:09,793286476301799424,iPhone,This is Moreton. He's the Good Boy Who Lived. 13/10 magical as h*ck,13.0,10.0,Moreton,,01-11-2016,03:00,1.3,https://pbs.twimg.com/media/CwJR1okWIAA6XMp.jpg,0.274637,afghan hound,2016-11-01 03:00:09,26445,10145,7523763,140516
2016-11-01 00:00:38,793241302385262592,iPhone,This is Tucker. He's out here bustin h*ckin ghosts. 13/10 dedicated af,13.0,10.0,Tucker,,01-11-2016,00:00,1.3,https://pbs.twimg.com/media/CwIougTWcAAMLyq.jpg,0.559308,golden retriever,2016-11-01 00:00:38,11302,3609,7523763,140516
2016-10-31 23:00:11,793226087023144960,iPhone,"This is Juno. She spooked me up real good, but only to get my attention. Above average handwriting for a dog I think. 11/10",11.0,10.0,Juno,,31-10-2016,23:00,1.1,https://pbs.twimg.com/media/CwIa5CjW8AErZgL.jpg,0.456047,wire-haired fox terrier,2016-10-31 23:00:11,10583,3154,7523763,140516
2016-10-31 18:00:14,793150605191548928,iPhone,This is Nida. She's a free elf. Waited so long for this day. 11/10,11.0,10.0,Nida,,31-10-2016,18:00,1.1,https://pbs.twimg.com/media/CwHWOZ7W8AAHv8S.jpg,0.193869,italian greyhound,2016-10-31 18:00:14,6629,1880,7523763,140516
2016-10-31 17:00:11,793135492858580992,iPhone,Your favorite squad is looking extra h*ckin spooky today. 13/10 for all,13.0,10.0,,,31-10-2016,17:00,1.3,https://pbs.twimg.com/media/CwHIg61WIAApnEV.jpg,0.737041,bakery,2016-10-31 17:00:11,6960,2752,7523763,140516
2016-10-31 00:20:11,792883833364439040,iPhone,This is Bailey. She's rather h*ckin hype for Halloween tomorrow. Carved those pupkins herself. 12/10,12.0,10.0,Bailey,,31-10-2016,00:20,1.2,https://pbs.twimg.com/media/CwDjoH3WAAIniIs.jpg,0.999306,jack-o'-lantern,2016-10-31 00:20:11,12158,4710,7523763,140516
2016-10-30 17:02:53,792773781206999040,iPhone,This is Monster. Not an actual monster tho. He's showing you his tongue. Very impressive Monster. 12/10 would snug,12.0,10.0,Monster,,30-10-2016,17:02,1.2,https://pbs.twimg.com/media/CwB_i-zXEAEiP29.jpg,0.912804,yorkshire terrier,2016-10-30 17:02:53,7888,1852,7523763,140516
2016-10-29 15:55:58,792394556390137856,iPhone,Meet BeBe. She rocks the messy bun of your dreams. H*ckin flawless. 12/10 would watch her tutorial,12.0,10.0,BeBe,,29-10-2016,15:55,1.2,https://pbs.twimg.com/media/Cv8moW9W8AIHOxR.jpg,0.746387,cocker spaniel,2016-10-29 15:55:58,14458,4717,7523763,140516
2016-10-28 17:07:05,792050063153438720,iPhone,This is Remus. He's a mop that came to life. Can't see anything. Constantly trips over himself. Still a very good dog. 11/10,11.0,10.0,Remus,,28-10-2016,17:07,1.1,https://pbs.twimg.com/media/Cv3tU38WcAASFas.jpg,0.942856,komondor,2016-10-28 17:07:05,7705,1979,7523763,140516
2016-10-27 16:06:04,791672322847637504,iPhone,When she says you're a good boy and you know you're a good boy because you're a good boy. 13/10,13.0,10.0,,,27-10-2016,16:06,1.3,https://pbs.twimg.com/media/CvyVxQRWEAAdSZS.jpg,0.705092,golden retriever,2016-10-27 16:06:04,12619,3437,7523763,140516
2016-10-26 22:31:36,791406955684368384,iPhone,Say hello to Levi. He's a Madagascan Butterbop. One of the more docile Butterbops I've seen. 12/10 would give all the pets,12.0,10.0,Levi,,26-10-2016,22:31,1.2,https://pbs.twimg.com/media/CvukbEkWAAAV-69.jpg,0.972629,pembroke,2016-10-26 22:31:36,14083,4536,7523763,140516
2016-10-25 16:00:09,790946055508652032,iPhone,This is Betty. She's assisting with the dishes. Such a good puppo. 12/10 h*ckin helpful af,12.0,10.0,Betty,puppo,25-10-2016,16:00,1.2,https://pbs.twimg.com/media/CvoBPWRWgAA4het.jpg,0.700466,dishwasher,2016-10-25 16:00:09,17842,5170,7523763,140516
2016-10-24 23:37:28,790698755171364864,iPhone,This is Mosby. He appears to be rather h*ckin snuggable af. 12/10 keep it up Mosby,12.0,10.0,Mosby,,24-10-2016,23:37,1.2,https://pbs.twimg.com/media/CvkgUjbUsAEvo7l.jpg,0.996541,bernese mountain dog,2016-10-24 23:37:28,8794,2100,7523763,140516
2016-10-24 15:53:19,790581949425475584,iPhone,This is Duke. He sneaks into the fridge sometimes. It's his safe place. 11/10 would give little jacket if necessary,11.0,10.0,Duke,,24-10-2016,15:53,1.1,https://pbs.twimg.com/media/Cvi2FiKWgAAif1u.jpg,0.998886,refrigerator,2016-10-24 15:53:19,22199,7908,7523763,140516
2016-10-23 00:27:05,789986466051088384,iPhone,This is Happy. He's a bathtub reviewer. Seems to be pleased with this one. 12/10,12.0,10.0,Happy,,23-10-2016,00:27,1.2,https://pbs.twimg.com/media/CvaYgDOWgAEfjls.jpg,0.479477,tub,2016-10-23 00:27:05,9934,2550,7523763,140516
2016-10-21 18:16:44,789530877013393408,iPhone,This is Rizzy. She smiles a lot. 12/10 contagious af,12.0,10.0,Rizzy,,21-10-2016,18:16,1.2,https://pbs.twimg.com/media/CvT6IV6WEAQhhV5.jpg,0.363272,schipperke,2016-10-21 18:16:44,12635,3708,7523763,140516
2016-10-21 00:53:56,789268448748703744,iPhone,This is Stella. She's happier than I will ever be. 10/10 would trade lives with,10.0,10.0,Stella,,21-10-2016,00:53,1.0,https://pbs.twimg.com/media/CvQLdotWcAAZn86.jpg,0.81286,malamute,2016-10-21 00:53:56,9783,2834,7523763,140516
2016-10-20 01:03:11,788908386943430656,iPhone,"This is Lucy. She destroyed not one, but two remotes trying to turn off the debate. 11/10 relatable af",11.0,10.0,Lucy,,20-10-2016,01:03,1.1,https://pbs.twimg.com/media/CvLD-mbWYAAFI8w.jpg,0.8815379999999999,remote control,2016-10-20 01:03:11,29419,13622,7523763,140516
2016-10-19 15:37:03,788765914992902144,iPhone,This is Butter. She can have whatever she wants forever. 12/10 would hug softly,12.0,10.0,Butter,,19-10-2016,15:37,1.2,https://pbs.twimg.com/media/CvJCabcWgAIoUxW.jpg,0.500509,cocker spaniel,2016-10-19 15:37:03,29449,11337,7523763,140516
2016-10-18 16:11:17,788412144018661376,iPhone,This is Dexter. He breaks hearts for a living. 11/10 h*ckin handsome af,11.0,10.0,Dexter,,18-10-2016,16:11,1.1,https://pbs.twimg.com/media/CvEAqQoWgAADj5K.jpg,0.805238,golden retriever,2016-10-18 16:11:17,16741,5837,7523763,140516
2016-10-17 22:51:57,788150585577050112,iPhone,This is Leo. He's a golden chow. Rather h*ckin rare. 13/10 would give extra pats,13.0,10.0,Leo,,17-10-2016,22:51,1.3,https://pbs.twimg.com/media/CvASw6dWcAQmo3X.jpg,0.814145,chow,2016-10-17 22:51:57,6603,1433,7523763,140516
2016-10-17 00:20:47,787810552592695296,iPhone,This is Frank. He wears sunglasses and walks himself. 11/10 I'll never be this cool or independent,11.0,10.0,Frank,,17-10-2016,00:20,1.1,https://pbs.twimg.com/media/Cu7dg2RXYAIaGXE.jpg,0.362835,pug,2016-10-17 00:20:47,9311,3355,7523763,140516
2016-10-16 18:11:26,787717603741622272,iPhone,This is Tonks. She is a service puppo. Can hear a caterpillar hiccup from 7 miles away. 13/10 would follow anywhere,13.0,10.0,Tonks,puppo,16-10-2016,18:11,1.3,https://pbs.twimg.com/media/Cu6I9vvWIAAZG0a.jpg,0.992339,german shepherd,2016-10-16 18:11:26,10962,3061,7523763,140516
2016-10-15 16:01:13,787322443945877504,iPhone,This is Lincoln. He forgot to use his blinker when he changed lanes just now. Guilty as h*ck. Still 10/10,10.0,10.0,Lincoln,,15-10-2016,16:01,1.0,https://pbs.twimg.com/media/Cu0hlfwWYAEdnXO.jpg,0.747739,seat belt,2016-10-15 16:01:13,8360,1915,7523763,140516
2016-10-14 16:13:10,786963064373534720,iPhone,This is Rory. He's got an interview in a few minutes. Looking spiffy af. Nervous as h*ck tho. 12/10 would hire,12.0,10.0,Rory,,14-10-2016,16:13,1.2,https://pbs.twimg.com/media/Cuvau3MW8AAxaRv.jpg,0.915303,golden retriever,2016-10-14 16:13:10,28517,8780,7523763,140516
2016-10-13 23:23:56,786709082849828864,iPhone,"This is Logan, the Chow who lived. He solemnly swears he's up to lots of good. H*ckin magical af 9.75/10",75.0,10.0,Logan,,13-10-2016,23:23,7.5,https://pbs.twimg.com/media/CurzvFTXgAA2_AP.jpg,0.467321,pomeranian,2016-10-13 23:23:56,19497,6694,7523763,140516
2016-10-13 20:28:35,786664955043049472,iPhone,"""Honestly Kathleen I just want more Ken Bone"" 12/10",12.0,10.0,,,13-10-2016,20:28,1.2,https://pbs.twimg.com/media/CurLmoqXgAEPoJ-.jpg,0.512034,leonberg,2016-10-13 20:28:35,11432,2819,7523763,140516
2016-10-13 15:54:28,786595970293370880,iPhone,This is Dale. He's a real spookster. Did me quite the frighten. 11/10 not too spooky to pet tho,11.0,10.0,Dale,,13-10-2016,15:54,1.1,https://pbs.twimg.com/media/CuqM0fVWAAAboKR.jpg,0.709512,pembroke,2016-10-13 15:54:28,10091,3403,7523763,140516
2016-10-13 00:29:39,786363235746385920,iPhone,This is Rizzo. He has many talents. A true renaissance doggo. 13/10 entertaining af,13.0,10.0,Rizzo,doggo,13-10-2016,00:29,1.3,https://pbs.twimg.com/media/Cum5LlfWAAAyPcS.jpg,0.929266,golden retriever,2016-10-13 00:29:39,11694,3853,7523763,140516
2016-10-11 19:39:28,785927819176054784,iPhone,This is Lucy. She's strives to be the best potato she can be. 12/10 would boop,12.0,10.0,Lucy,,11-10-2016,19:39,1.2,https://pbs.twimg.com/media/CugtKeXWEAAamDZ.jpg,0.97207,teddy,2016-10-11 19:39:28,12176,3473,7523763,140516
2016-10-11 00:34:48,785639753186217984,iPhone,This is Pinot. He's a sophisticated doggo. You can tell by the hat. Also pointier than your average pupper. Still 10/10 would pet cautiously,10.0,10.0,Pinot,"pupper, doggo",11-10-2016,00:34,1.0,https://pbs.twimg.com/media/CucnLmeWAAALOSC.jpg,0.978042,porcupine,2016-10-11 00:34:48,8371,2434,7523763,140516
2016-10-09 23:44:41,785264754247995392,iPhone,This is Doc. He requested to be carried around like that. 12/10 anything for Doc,12.0,10.0,Doc,,09-10-2016,23:44,1.2,https://pbs.twimg.com/media/CuXSHNnWcAIWEwn.jpg,0.6748930000000001,teddy,2016-10-09 23:44:41,7790,1798,7523763,140516
2016-10-09 17:31:53,785170936622350336,iPhone,This is Hero. He was enjoying the car ride until he remembered that bees are dying globally at an alarming rate. 11/10,11.0,10.0,Hero,,09-10-2016,17:31,1.1,https://pbs.twimg.com/media/CuV8yfxXEAAUlye.jpg,0.891193,seat belt,2016-10-09 17:31:53,12971,5340,7523763,140516
2016-10-07 16:33:21,784431430411685888,iPhone,This is Stormy. He's curly af. Already pupared for Coachella next year. 12/10,12.0,10.0,Stormy,,07-10-2016,16:33,1.2,https://pbs.twimg.com/media/CuLcNkCXgAEIwK2.jpg,0.744819,miniature poodle,2016-10-07 16:33:21,6103,1407,7523763,140516
2016-10-06 01:23:05,783839966405230592,iPhone,This is Riley. His owner put a donut pillow around him and he loves it so much he won't let anyone take it off. 13/10,13.0,10.0,Riley,,06-10-2016,01:23,1.3,https://pbs.twimg.com/media/CuDCSM-XEAAJw1W.jpg,0.333739,quilt,2016-10-06 01:23:05,32184,11860,7523763,140516
2016-10-05 00:40:09,783466772167098368,iPhone,This is Finn. He likes eavesdropping from filing cabinets. It's a real issue but no one has approached him about it. 11/10 would still pet,11.0,10.0,Finn,,05-10-2016,00:40,1.1,https://pbs.twimg.com/media/Ct9u3ljW8AEnVIm.jpg,0.789,chihuahua,2016-10-05 00:40:09,9042,2475,7523763,140516
2016-10-04 19:42:03,783391753726550016,iPhone,Meet Godi. He's an avid beachgoer and part time rainbow summoner. Eyeliner flawless af. 13/10 would snug well,13.0,10.0,Godi,,04-10-2016,19:42,1.3,https://pbs.twimg.com/media/Ct8qn8EWIAAk9zP.jpg,0.87713,norwegian elkhound,2016-10-04 19:42:03,18045,6045,7523763,140516
2016-10-04 15:55:06,783334639985389568,iPhone,This is Dave. He's currently in a predicament. Doesn't seem to mind tho. 12/10 someone assist Dave,12.0,10.0,Dave,,04-10-2016,15:55,1.2,https://pbs.twimg.com/media/Ct72q9jWcAAhlnw.jpg,0.593858,cardigan,2016-10-04 15:55:06,31285,12854,7523763,140516
2016-10-03 15:42:44,782969140009107456,iPhone,This is Cali. She arrived preassembled. Convenient af. 12/10 appears to be rather h*ckin pettable,12.0,10.0,Cali,,03-10-2016,15:42,1.2,https://pbs.twimg.com/media/Ct2qO5PXEAE6eB0.jpg,0.474292,seat belt,2016-10-03 15:42:44,25812,8073,7523763,140516
2016-10-03 01:00:34,782747134529531904,iPhone,This is Deacon. He's the happiest almost dry doggo I've ever seen. 11/10 would smile back,11.0,10.0,Deacon,doggo,03-10-2016,01:00,1.1,https://pbs.twimg.com/media/CtzgXgeXYAA1Gxw.jpg,0.560699,golden retriever,2016-10-03 01:00:34,7988,1529,7523763,140516
2016-10-02 23:23:04,782722598790725632,iPhone,"This is Penny. She fought a bee and the bee won. 10/10 you're fine Penny, everything's fine",10.0,10.0,Penny,,02-10-2016,23:23,1.0,https://pbs.twimg.com/media/CtzKC7zXEAALfSo.jpg,0.574557,irish setter,2016-10-02 23:23:04,18484,5919,7523763,140516
2016-10-01 19:47:08,782305867769217024,iPhone,This is Sampson. He just graduated. Ready to be a doggo now. Time for the real world. 12/10 have fun with taxes,12.0,10.0,Sampson,doggo,01-10-2016,19:47,1.2,https://pbs.twimg.com/media/CttPBt0WIAAcsDE.jpg,0.5044270000000001,briard,2016-10-01 19:47:08,17844,6111,7523763,140516
2016-09-30 20:33:43,781955203444699136,iPhone,This is Chipson. He weighed in at .3 ounces and is officially super h*ckin smol. Space-saving af. 11/10 would snug delicately,11.0,10.0,Chipson,,30-09-2016,20:33,1.1,https://pbs.twimg.com/media/CtoQGu4XgAQgv5m.jpg,0.179568,pool table,2016-09-30 20:33:43,11888,3685,7523763,140516
2016-09-30 01:08:10,781661882474196992,iPhone,Who keeps sending in pictures without dogs in them? This needs to stop. 5/10 for the mediocre road,5.0,10.0,,,30-09-2016,01:08,0.5,https://pbs.twimg.com/media/CtkFS72WcAAiUrs.jpg,0.438087,pembroke,2016-09-30 01:08:10,11164,2971,7523763,140516
2016-09-29 16:03:01,781524693396357120,iPhone,Idk why this keeps happening. We only rate dogs. Not Bangladeshi Couch Chipmunks. Please only send dogs... 12/10,12.0,10.0,,,29-09-2016,16:03,1.2,https://pbs.twimg.com/media/CtiIj0AWcAEBDvw.jpg,0.994712,tennis ball,2016-09-29 16:03:01,22203,6076,7523763,140516
2016-09-28 16:07:23,781163403222056960,iPhone,"We normally don't rate lobsters, but this one appears to be a really good lobster. 10/10 would pet with caution",10.0,10.0,,,28-09-2016,16:07,1.0,https://pbs.twimg.com/media/Ctc_-BTWEAAQpZh.jpg,0.973841,shetland sheepdog,2016-09-28 16:07:23,10439,2994,7523763,140516
